Job Title,Company Name,Job Description,Location,Employment Type,Query_Value,Posted Scraped,Posted On,Updated Scraped,Updated On,Company Link,From Total Job Count
Data Analyst Internship,Job Wize,"Trainee Data Analyst<>REMOTEJob Description:We are seeking an enthusiastic and detail-oriented Trainee Data Analyst to join our growing team. In this entry-level position, you will be introduced to the dynamic world of data analysis, where you will develop essential skills and gain hands-on experience needed to analyze and interpret data across various business functions. Responsibilities:Assist in collecting, tracking, and analyzing data from multiple sources.Support the data analysis team in m","Dallas, TX, USA",Full-time,Data Internship Internship,15 days ,2024-04-19 03:29:57.949886,15 days ago ,,https://www.dice.com/company/91159959?companyname=Job%20Wize,23
IBM Datacap Developer,P2PSoftTek Inc,"IBM Datacap Developer Remote Role Description : Collaborate with stakeholders to gather and analyze business requirements for document capture and data extraction processes.Design and architect IBM Datacap, AWS Textract solutions to meet business needs, including document classification, data extraction, and workflow automation.Develop and customize IBM Datacap, AWS Textract applications flows, modules, and components using Datacap Studio, Datacap Navigator, and other tools.Configure and optimiz","Dallas, TX, USA","Contract, Third Party",Data Internship Internship,24 days ,2024-04-10 03:29:57.950886,20 hours ago ,,https://www.dice.com/company/90868495?companyname=P2PSoftTek%20Inc,23
Enterprise Data Speclialist,Genome International Corp,"looking for a contractor to provide Data Governance services in support of the Statewide Longitudinal Data Systems (SLDS) federal grant efforts. CDE received the grant award in 2020, and it will continue through February 2025. The early years of the grant focused on two use case areas, Adult Education (AE) and Concurrent Enrollment (CE). There is a significant technology component to this grant effort, CDE already has data-linking technology in place and part of the grant commitment is to modern","Dallas, TX, USA",Contract,Data Internship Internship,44 days ,2024-03-21 03:29:57.950886,1 day ago ,,https://www.dice.com/company/genwi001?companyname=Genome%20International%20Corp,23
Test Do Not Apply - Senior Full Stack Developer,Dice US Sales Demo Account,"Job Type: Full-time Location: Greenwood Village, Colorado We are seeking an experienced Senior Full Stack Developer to join our dynamic team. The successful candidate will be responsible for developing, maintaining, and enhancing web applications that meet the needs of our clients. As a Senior Full Stack Developer, you will work closely with our cross-functional teams to ensure that our products are delivered on time, within budget, and to the highest quality standards. Responsibilities: Develop","Dallas, TX, USA",Full-time,Data Internship Internship,18 days ,2024-04-16 03:29:57.951877,4 days ago ,,https://www.dice.com/company/dicedemo?companyname=Dice%20US%20Sales%20Demo%20Account,23
ServiceNow Developer,CrackaJack Digital Solutions,"Plano, TX, Columbus, OH & Wilmington, DE Job responsibilities: Executes software solutions, design, development, and technical troubleshooting with ability to think beyond routine or conventional approaches to build solutions or break down technical problems Creates secure and high-quality production code and maintains algorithms that run synchronously with appropriate systems Produces architecture and design artifacts for complex applications while being accountable for ensuring design constrai","Dallas, TX, USA","Contract, Third Party",Data Internship Internship,1 day ,2024-05-03 03:29:57.952886,,,https://www.dice.com/company/91021502?companyname=CrackaJack%20Digital%20Solutions,23
ServiceNow Developer,Info Dinamica Inc,"Must Have:  Certifications verified Minimum two (Certification Verification email require from suppliers)Role verified Should be part of core development and Implementation team. Done scripting and Rest API based integrations.Understand converting a Business Requirements to a workflow and implement the same.HR Service Delivery module experienceService portal experience.Job responsibilities Executes software solutions, design, development, and technical troubleshooting with ability to think beyon","Dallas, TX, USA",Contract,Data Internship Internship,3 days ,2024-05-01 03:29:57.952886,,,https://www.dice.com/company/91091604?companyname=Info%20Dinamica%20Inc,23
Sales Intern (IT),RisamSoft Inc,"Duration: 3-6 months, with potential for long-term conversion. Job Description: We are a rapidly growing technology company looking for an enthusiastic and driven Sales Intern to join our dynamic sales team. This position offers the opportunity to gain firsthand experience in sales and marketing strategies, customer relationship management, and the fast-paced environment of a tech startup. The ideal candidate is a motivated individual with a passion for technology and an eagerness to learn and c","Dallas, TX, USA",Full-time,Data Internship Internship,19 days ,2024-04-15 03:29:57.953886,19 days ago ,,https://www.dice.com/company/91112109?companyname=RisamSoft%20Inc,23
Fullstack Developer (W2/1099),ResolveTech Solutions Inc.,"5+ years of experience with backend frameworks (node.js, NestJS)5+ years of solid foundation and understanding of relational and NoSQL database principles.5+ years of experience with AWS Cloud Services5+ years of experience in creating API using NodeJS, Python, Java, or Go developing software solutions for real world problems (Recent experience in NodeJS required)5+ years of experience with microservices or SOA Architecture and other design patternsExperience working with Confluent Kafka, Kafka","Dallas, TX, USA",Contract,Data Internship Internship,29 days ,2024-04-05 03:29:57.953886,,,https://www.dice.com/company/10368525?companyname=ResolveTech%20Solutions%20Inc.,23
Service Now Developer @W2,Globex IT Solutions INC,"Job Title: Service Now Developer Experience: 6 to 12+ Years Location: Wilmington DE, Columbus OH, Plano TX (Non-Locals are fine for Contractors) Duration: Long Term Job Description: Certifications verified Minimum two (Certification Verification email require from suppliers)Role verified Should be part of core development and Implementation team. Done scripting and Rest API based integrations.Understand converting a Business Requirements to a workflow and implement the same.HR Service Delivery m","Dallas, TX, USA",Full-time,Data Internship Internship,3 days ,2024-05-01 03:29:57.954886,20 hours ago ,,https://www.dice.com/company/91135097?companyname=Globex%20IT%20Solutions%20INC,23
Pear Script Developer,SelSoft Inc.,"Hi Thara, Greetings from Selsoft Inc!! Role: Perl Script developer Location: Plano, TX (Day 1 Onsite) Duration: Contract Looking for 6-8 Yrs of Perl/Shell Scripting development experience. Participating in planning the software architecture of new systems spanning multiple teams and platforms Unix or Linux command Line Deliver high quality, scalable code to solve both tactical and strategic problems. Analysis of requirements, high level and detailed design, integration, and implementation activi","Dallas, TX, USA","Third Party, Contract",Data Internship Internship,7 days ,2024-04-27 03:29:57.955886,,,https://www.dice.com/company/10307276?companyname=SelSoft%20Inc.,23
Sr. Java Developer - Hybrid Role - Dallas/TX,CoppelTech,"Looking for a Mid-Sr level Java developer with atleast 8 years of experience for a Banking Client with following skills :- Responsibilities: Design, develop, and maintain high-quality Java applications and services.Collaborate with product owners, business analysts, and other stakeholders to gather and refine requirements.Translate business requirements into technical specifications and architectural designs.Implement best practices for software development, including code reviews, testing, and","Dallas, TX, USA","Third Party, Contract",Data Internship Internship,7 days ,2024-04-27 03:29:57.955886,,,https://www.dice.com/company/91141956?companyname=CoppelTech,23
Sr Java Developer,Caprus IT Inc.,"Job Title: Sr. Java Developer or Full Stack Java/React developer. Location: Frisco, TX (Onsite) Duration: Contract (W2) / Fulltime 10+ Years of IT Experience is must  Roles and Responsibilities Writing well-designed, testable, and efficient code.Providing code documentation and other inputs to technical documents.Supporting continuous improvement by investigating alternatives and new technologies and presenting these for architectural review.Troubleshooting and debugging to optimize performance.","Dallas, TX, USA",Full-time,Data Internship Internship,16 days ,2024-04-18 03:29:57.956886,14 hours ago ,,https://www.dice.com/company/10297302?companyname=Caprus%20IT%20Inc.,23
Lead Salesforce Developer,Incedo Inc,"Position: Salesforce Technical Lead  Location: Pittsburgh, PA (remote) Duration: Full time As a Salesforce Lead with expertise in Experience Cloud, Service Cloud, and Marketing Cloud, you will play a critical role in the design, development, and maintenance of our client s Salesforce ecosystem. Must have experience in working with globally distributed teams and agile delivery. You will collaborate with cross-functional teams to implement and optimize solutions that enhance customer experiences,","Dallas, TX, USA",Full-time,Data Internship Internship,3 days ,2024-05-01 03:29:57.957886,,,https://www.dice.com/company/10476889?companyname=Incedo%20Inc,23
Sales Leader - Insurance,"IRIS Software, Inc.","About IRIS Software Inc. IRIS Software Inc. ( has a proven legacy of over 3 decades in helping our enterprise clients thrive with technology-enabled transformation across Banking, Financial Services, Insurance, Life Sciences, Healthcare, Professional Services, Manufacturing, Transportation, and Logistics sectors. Our services cover core, complex, mission-critical Application and Product Engineering, Data and Analytics, Cloud Engineering, DevSecOps, Quality Engineering, UX transformation, and Bus","Dallas, TX, USA","Full-time, Third Party",Data Internship Internship,60+ days ,2024-03-05 03:29:57.957886,8 days ago ,,https://www.dice.com/company/irissoft?companyname=IRIS%20Software%2C%20Inc.,23
Tricentis Tosca Neoload Architect,SumasEdge Corporation,"We are seeking a skilled and experienced Tricentis Tosca & NeoLoad Architect to join our dynamic team. The ideal candidate will have a strong background in software testing, particularly in test automation using Tricentis Tosca, as well as performance testing using NeoLoad. This role will involve designing, implementing, and optimizing test automation and performance testing solutions to ensure the quality and scalability of our software products.  Responsibilities:  Design and implement test au","Dallas, TX, USA","Third Party, Contract",Data Internship Internship,23 days ,2024-04-11 03:29:57.958886,16 hours ago ,,https://www.dice.com/company/90859492?companyname=SumasEdge%20Corporation,23
"ServiceNow Architect field service module mandatory , Remote",Spiceorb,"Hi, This is Upasna from Spiceorb.we have opening for Servicenow Architect role.If you are available and interested send your updated resume to  ServiceNow Architect, remote role The ServiceNow Architect plays a critical role in the design, implementation, and optimization of ServiceNow solutions within the organization.This position requires a deep understanding of the ServiceNow platform, IT service management processes, and business requirements to architect solutions that drive efficiency, au","Dallas, TX, USA","Contract, Third Party",Data Internship Internship,9 days ,2024-04-25 03:29:57.958886,7 days ago ,,https://www.dice.com/company/91109480?companyname=Spiceorb,23
Automation Architect,Qualibar,"Job Title: Automation Architect Position: Full Time Client: PWC Location: Remote//Remote/Hybrid  Description: Experience in creation of application specific test strategy and Automation test plan Expertise in creation / maintenance of Test Automation framework (Hybrid / TDD / BDD) from scratch Expertise in creation of API / UI Automated test scripts using Selenium with Java & RestAPI/SoapUI  Exposure and experience in Katalon, Parasoft and Azure ADO are added advantage Hands on experience in del","Dallas, TX, USA",Full-time,Data Internship Internship,60+ days ,2024-03-05 03:29:57.959886,20 hours ago ,,https://www.dice.com/company/91132260?companyname=Qualibar,23
Kafka Admin,Galax-Esystems Corp,"Role Kafka Tech Admin Location: Remote Duration:6-12 Months Job Responsibility Primary responsibility of Confluent Platform Administrator will be to build, test and maintain Kafka Cluster and its eco-system which is deployed to run Data Streaming use cases for various business units Experience Overall 5+ years of experience out of which 2+ years around Confluent Platform administration Mandatory Job Requirements Manage single and multi-node Kafka cluster deployed on VM, Docker and Kubernetes Con","Dallas, TX, USA","Contract, Third Party",Data Internship Internship,13 hours ,2024-05-03 14:29:57.960865,,,https://www.dice.com/company/10230239?companyname=Galax-Esystems%20Corp,23
Mid Level. Java Developer - Remote,CoppelTech,"Looking for a Mid level Java developer with atleast 6 years of experience on following skills :- Responsibilities: Design, develop, and maintain high-quality Java applications and services.Collaborate with product owners, business analysts, and other stakeholders to gather and refine requirements.Translate business requirements into technical specifications and architectural designs.Implement best practices for software development, including code reviews, testing, and documentation.Troubleshoot","Dallas, TX, USA","Contract, Third Party",Data Internship Internship,4 days ,2024-04-30 03:29:57.961863,,,https://www.dice.com/company/91141956?companyname=CoppelTech,23
Jr. UI Developer (entry level/Intern) 1 to 3 years of experience.,New Jersey Tech Systems LLC,"New Jersey Tech Systems is a leader in the industry by offering high-technology solutions that save on overall time and cost. We do this by providing scalable support for clients entire project needs that are effective, affordable, and easy to understand. - Location: Princeton, NJ - Salary: $50,000 - $60,000. - Visa sponsorship is available for qualified employees. - *No experience is required but better to have. - 100% remote. - Contact details: | Knowledge and Skills: Exposed to and/or experie","Dallas, TX, USA",Full-time,Data Internship Internship,4 days ,2024-04-30 03:29:57.961863,4 days ago ,,https://www.dice.com/company/90979221b?companyname=New%20Jersey%20Tech%20Systems%20LLC,23
Full-Stack Developer (entry level/Intern) 1 to 3 years of experience.,New Jersey Tech Systems LLC,"New Jersey Tech Systems is a leader in the industry through offering high-technology solutions that save on overall time and cost. We do this by providing scalable support for clients' entire project needs that are effective, affordable, and easy to understand. Location: Princeton, NJ. Salary: $50,000 - $60,000 Visa sponsorship is available for qualified employees. *No experience is required but better to have. - 100% remote. - Contact details: | Knowledge and Skills Knowledge of creating front-","Dallas, TX, USA",Full-time,Data Internship Internship,4 days ,2024-04-30 03:29:57.963415,4 days ago ,,https://www.dice.com/company/90979221b?companyname=New%20Jersey%20Tech%20Systems%20LLC,23
Azure Cloud/DevOps Engineer -  Lead,Astir IT Solutions,"Experience as a cloud/DevOps engineer with Strong scripting skills. Experience with Microsoft Azure cloud services, including IaaS and PaaS technologies. Experience with automation tools such as Azure DevOps, Ansible, Terraform, or Chef. Build and maintain CI/CD pipelines to enable delivery of cloud-native applications. Implement infrastructure as code to automate the deployment of infrastructure resources. Design and implement monitoring and logging solutions for the cloud environment. Collabor","Dallas, TX, USA","Third Party, Contract",Data Internship Internship,60+ days ,2024-03-05 03:29:57.964000,12 hours ago ,,https://www.dice.com/company/10110032?companyname=Astir%20IT%20Solutions,23
SAP MM Functional consultant,Vrddhi Solutions LLC,"Position-SAP MM Functional consultant Location-onsite 2-3 days a week (Northfield) Visa: No OPT CPT Experience: 8+Years Duration-18m-2 years Job Description:  AP MM Functional Consultant Roles & ResponsibilitiesFacilitate the implementation and support of SAP MMPerform detailed analysis of complex business process requirements and provide appropriate system solutions; identify, interpret, validate and document customer requirementsFacilitate workshops to collect business requirementsMap client b","Dallas, TX, USA","Contract, Third Party",Data Internship Internship,60+ days ,2024-03-05 03:29:57.964000,4 days ago ,,https://www.dice.com/company/91138338?companyname=Vrddhi%20Solutions%20LLC,23
