Job Title,Company Name,Job Description,Location,Employment Type,Query_Value,Posted Scraped,Posted On,Updated Scraped,Updated On,Company Link,From Total Job Count
Data Analyst Internship,Job Wize,"Trainee Data Analyst<>REMOTEJob Description:We are seeking an enthusiastic and detail-oriented Trainee Data Analyst to join our growing team. In this entry-level position, you will be introduced to the dynamic world of data analysis, where you will develop essential skills and gain hands-on experience needed to analyze and interpret data across various business functions. Responsibilities:Assist in collecting, tracking, and analyzing data from multiple sources.Support the data analysis team in m","Dallas, TX, USA",Full-time,Data Internship,15 days ,2024-04-19 03:12:50.513339,15 days ago ,,https://www.dice.com/company/91159959?companyname=Job%20Wize,146
Data Discovery (BigID) Engineer,"InnoCore Solutions, Inc.","The Data Discovery (BigID) engineer will work as part of the Asset Discovery team to roll out BigID across our client organization. This individual will work with Data Discovery analysts and enterprise platform teams to scan enterprise structured and unstructured data sources, assess data classification and collaborate with the Data Governance team. Requirements: Experience in data discovery/governance technologies such as BigID, Informatica, etc. Experience in Data management disciplines such a","Dallas, TX, USA",Contract,Data Internship,2 days ,2024-05-02 03:12:50.513339,22 hours ago ,,https://www.dice.com/company/10120357?companyname=InnoCore%20Solutions%2C%20Inc.,146
SAP Master Data Governance Consultant Functional Expert,Tek Inspirations LLC,"Job Description - Job Title: SAP Master Data Governance Consultant Functional Expert Job Type:  Contract- 12+ months  Duration:  Starting ASAP and going through June 28th, 2024 there is a slight possibility that the project could be extended should the Proof of Concept go well and the project be extended, but not guaranteed What is key to do- This will be a project in which the resources will be creating a POC Proof of Concept for the end client, and will kick off ASAP and run through the middle","Dallas, TX, USA","Contract, Third Party",Data Internship,1 day ,2024-05-03 03:12:50.513339,1 day ago ,,https://www.dice.com/company/91099133?companyname=Tek%20Inspirations%20LLC,146
Profisee MDM Engineer,Fusion Global Solutions,"Responsibilities: Participate in JAD, workshops and/or business requirements sessions to understand, identify and detail MDM requirements and key criteriaWork with stakeholders in gathering the Match & Merge rules, develop & configure trust matrix, match path, match columns, match rules (Exact and Fuzzy) and data stewardship workflowsFind gaps and data anomalies and review the same with stakeholders for approval and identify next stepsDevelop and execute data profiling, data quality analysis and","Dallas, TX, USA","Contract, Third Party",Data Internship,10 days ,2024-04-24 03:12:50.513339,,,https://www.dice.com/company/91122985?companyname=Fusion%20Global%20Solutions,146
Teradata Data Analyst - W2 Only - HYBRID,"Mitchell Martin, Inc.","Teradata Data Analyst - W2 Only - HYBRID Location: Dallas, TX Duration: 12 Months +  W2 Only Hybrid Only in Dallas Metro, TX Data Analysis: Analyze data to detect suspicious activities and transactions using advanced analytics techniques. Develop data-driven models to identify patterns indicative of financial crimes. Reporting and Visualization: Generate reports and dashboards to communicate findings to stakeholders. Design interactive data visualizations to enhance understanding of financial cr","Dallas, TX, USA",Contract,Data Internship,15 days ,2024-04-19 03:12:50.513339,4 days ago ,,https://www.dice.com/company/mitchmar2?companyname=Mitchell%20Martin%2C%20Inc.,146
Data Scientist Mid,ResolveTech Solutions Inc.,"Data Scientist MidIrving - TX (onsite from day-1) Key Responsibilities: Research, prototype, and develop algorithms and solutions to solve problems across retail. Work with tabular customer and transaction data to produce insights and analysis. Stay up to date with emerging technologies and learn new techniques/libraries/frameworks. Build and deploy algorithms and statistical solutions into production ready systems. Deliver on time with a high bar on quality of research, innovation, and engineer","Dallas, TX, USA",Contract,Data Internship,8 days ,2024-04-26 03:12:50.513339,,,https://www.dice.com/company/10368525?companyname=ResolveTech%20Solutions%20Inc.,146
Data Governance Engineer,"InnoCore Solutions, Inc.","Responsibilities: Work closely with source data application teams and product owners to design, implement and support analytics and data governance solutions that provide insights to make better decisions. Administer and Support one or more Data Governance platforms for Marketplace, Stewardship, Catalog, Quality and Literacy. Support the research, review, recommendation, purchase, installation, and buildout of new software for Data Quality, Observability and Data Access Management software. Supp","Dallas, TX, USA",Contract,Data Internship,2 days ,2024-05-02 03:12:50.513339,22 hours ago ,,https://www.dice.com/company/10120357?companyname=InnoCore%20Solutions%2C%20Inc.,146
Data Scienctist,ResolveTech Solutions Inc.,"Key Responsibilities: Research, prototype, and develop algorithms and solutions to solve problems across retail.Work with tabular customer and transaction data to produce insights and analysis.Stay up to date with emerging technologies and learn new techniques/libraries/frameworks.Build and deploy algorithms and statistical solutions into production ready systems.Deliver on time with a high bar on quality of research, innovation, and engineering.  Basic Qualifications: Strong knowledge of the fu","Dallas, TX, USA",Full-time,Data Internship,8 days ,2024-04-26 03:12:50.513339,,,https://www.dice.com/company/10368525?companyname=ResolveTech%20Solutions%20Inc.,146
Sr. Azure Data Engineer,"InnoCore Solutions, Inc.","Responsibilities: Implement data migration and data engineering solutions using Azure products and services: (Azure Data Lake Storage, Azure Data Factory, Azure Functions, Event Hub, Azure Stream Analytics, Azure Databricks, etc.) and traditional data warehouse toolsPerform multiple aspects involved in the development lifecycle design, cloud engineering (Infrastructure, network, security, and administration), ingestion, preparation, data modeling, testing, CICD pipelines, performance tuning, dep","Dallas, TX, USA",Contract,Data Internship,4 days ,2024-04-30 03:12:50.513339,1 day ago ,,https://www.dice.com/company/10120357?companyname=InnoCore%20Solutions%2C%20Inc.,146
Google Cloud Platform Data Architect,DVG Tech Solutions LLC,"Job Description: The Role We seek an experienced Google Cloud Platform Data Architect to shape and lead our data architecture and analytics initiatives on the Google Cloud Platform. You'll work closely with cross-functional teams to design scalable data solutions, optimize data pipelines, and enable data-driven decision-making across the organization. Key Responsibilities:  Architecture Design: Craft scalable and reliable data architectures on Google Cloud Platform, encompassing data ingestion,","Dallas, TX, USA","Third Party, Contract",Data Internship,10 days ,2024-04-24 03:12:50.513339,19 hours ago ,,https://www.dice.com/company/90922892?companyname=DVG%20Tech%20Solutions%20LLC,146
Technical Business Data Analyst - Banking - W2 Only,"Mitchell Martin, Inc.","Technical Business Data Analyst - Banking - W2 Only  Location: Plano, TX  Duration: 12-24 Months HYBRID ONLY in Dallas Metro area, TX W2 only Opening - Client only accepts W-2 Candidates The successful candidate will define the end-to-end requirements to support the target business process within Treasury. The candidate will contribute to the software development lifecycle of products and services from inception stage through to the final implementation. The candidate would be required to work c","Dallas, TX, USA",Contract,Data Internship,60+ days ,2024-03-05 03:12:50.513339,4 days ago ,,https://www.dice.com/company/mitchmar2?companyname=Mitchell%20Martin%2C%20Inc.,146
IBM Datacap Developer,P2PSoftTek Inc,"IBM Datacap Developer Remote Role Description : Collaborate with stakeholders to gather and analyze business requirements for document capture and data extraction processes.Design and architect IBM Datacap, AWS Textract solutions to meet business needs, including document classification, data extraction, and workflow automation.Develop and customize IBM Datacap, AWS Textract applications flows, modules, and components using Datacap Studio, Datacap Navigator, and other tools.Configure and optimiz","Dallas, TX, USA","Contract, Third Party",Data Internship,24 days ,2024-04-10 03:12:50.513339,19 hours ago ,,https://www.dice.com/company/90868495?companyname=P2PSoftTek%20Inc,146
Enterprise Data Speclialist,Genome International Corp,"looking for a contractor to provide Data Governance services in support of the Statewide Longitudinal Data Systems (SLDS) federal grant efforts. CDE received the grant award in 2020, and it will continue through February 2025. The early years of the grant focused on two use case areas, Adult Education (AE) and Concurrent Enrollment (CE). There is a significant technology component to this grant effort, CDE already has data-linking technology in place and part of the grant commitment is to modern","Dallas, TX, USA",Contract,Data Internship,44 days ,2024-03-21 03:12:50.523879,1 day ago ,,https://www.dice.com/company/genwi001?companyname=Genome%20International%20Corp,146
Sr Power BI developer with very strong SQL and Data Operations skills || W2 || Any Visa,Shiro Technologies,"Key Skills : Power BI, SQL, Retail Domain Job Summary : The ideal candidate will be part of an organization that is revolutionizing technology platforms and architecting a data and analytics landscape that is simplified, modern, flexible and will ultimately provide a foundation for all future analysis. This role will work closely with the business and technical Key Qualifications : Deep experience, 10 + years of experience in Power BI with very strong SQL. 5+ years visualization in a retail envi","Dallas, TX, USA",Contract,Data Internship,17 hours ,2024-05-03 10:12:50.523879,,,https://www.dice.com/company/10481525?companyname=Shiro%20Technologies,146
Lead Data Engineer with Palantir Foundry,Info Dinamica Inc,"Lead Data Engineer with Palantir Foundry - Remote NOTE - The consultant Needs to work In Europe Time Zone Total experience of 7+ years in Data Engineering and must have at least 3 years of experience in Palantir Foundry. Strong experience with Palantir Data Engineering features such as, Code Repo, Code Workbook, Pipeline Build, migration techniques, Data Connection and Security setup.Design, develop Data Pipelines, and have excellent skills in PySpark and Spark SQL, hands on with code Build and","Dallas, TX, USA","Contract, Third Party",Data Internship,29 days ,2024-04-05 03:12:50.523879,17 days ago ,,https://www.dice.com/company/91091604?companyname=Info%20Dinamica%20Inc,146
Residential Solutions Architect,Computomic,"Role: Resident Solution Architect (RSA) Experience: 10+ years years consulting, 7+ years in data engineering Location: London /Remote. United Kingdom Background: Computomic was founded in 2019 with a vision to design and deploy mission critical and highly differentiated Data & AI solutions for companies looking to migrate their data stack from legacy data platforms such as Teradata, Cloudera, Datastage and Informatica to modern data platforms like Databricks. Over the last few years, we have bec","Dallas, TX, USA",Contract,Data Internship,38 days ,2024-03-27 03:12:50.523879,23 days ago ,,https://www.dice.com/company/91129876?companyname=Computomic,146
AWS Data Architect,WinWire Technologies,"Job title: AWS Data Architect Pharma exp Must Location: Alameda, CA Remote Duration: open for full time/ Contract to hire  Let s not just look at Pharma experience since there could be folks with Clinical domain experience which is not relevant. It needs to be Pharma Commercial on domain and AWS Data Engineering / Architecture (hands on). Someone who can set direction, define data patterns, establish customer domains and design with AWS tools.  * Rebates * Marketing * Market Access * Sales * Arc","Dallas, TX, USA","Full-time, Third Party",Data Internship,57 days ,2024-03-08 03:12:50.523879,2 days ago ,,https://www.dice.com/company/RTL854830?companyname=WinWire%20Technologies,146
Test Do Not Apply - Senior Full Stack Developer,Dice US Sales Demo Account,"Job Type: Full-time Location: Greenwood Village, Colorado We are seeking an experienced Senior Full Stack Developer to join our dynamic team. The successful candidate will be responsible for developing, maintaining, and enhancing web applications that meet the needs of our clients. As a Senior Full Stack Developer, you will work closely with our cross-functional teams to ensure that our products are delivered on time, within budget, and to the highest quality standards. Responsibilities: Develop","Dallas, TX, USA",Full-time,Data Internship,18 days ,2024-04-16 03:12:50.523879,4 days ago ,,https://www.dice.com/company/dicedemo?companyname=Dice%20US%20Sales%20Demo%20Account,146
Azure Data Architect,Intraedge,"Job Title: : Azure Data Architect Location: REMOTE Duration: Long Term Contract  Responsibilities: Engineer Azure-based solutions with a focus on cost-efficiency, performance, and operational effectiveness. Craft and enforce a framework to quantify data quality across various customer and prospect sources, ensuring data accuracy, completeness, consistency, and timeliness. Scrutinize first-party customer data sources to establish the most reliable ones and formulate ingestion strategies for both","Dallas, TX, USA","Contract, Third Party",Data Internship,3 days ,2024-05-01 03:12:50.523879,1 day ago ,,https://www.dice.com/company/10121492?companyname=Intraedge,146
ITSM CMDB / Data Analysis expertise- 100% Remote role - Canada/LATAM Based,Acnovate Business Solutions Inc.,"ITSM CMDB / Data Analysis expertise 100% Remote (Near Shore - Canada/Latin America) Long term Contract Job Description: Configuration Management Database (CMDB) Maintenance: The Asset and Configuration Manager is responsible for managing and maintaining the CMDB in ServiceNow. This involves ensuring accurate and up-to-date information about all configuration items (CIs) within the IT infrastructure, including hardware, software, and other assets. Configuration Identification: Working with differ","Dallas, TX, USA","Contract, Third Party",Data Internship,37 days ,2024-03-28 03:12:50.528905,20 hours ago ,,https://www.dice.com/company/10127360?companyname=Acnovate%20Business%20Solutions%20Inc.,146
Collibra Data Quality Consultant (Collibra DQ),Xoriant Corporation,Looking for someone who is an expert on all functionalities provided by Collibra DQ.Preferred if they have worked with Collibra DQ in a healthcare setting.It would be even better if they have connected to Databricks as a data source from Collibra DQ.,"Dallas, TX, USA","Contract, Third Party",Data Internship,3 days ,2024-05-01 03:12:50.528905,,,https://www.dice.com/company/xorca001?companyname=Xoriant%20Corporation,146
Remote Azure Data and DevOps engineer,CapB InfoteK LLC,"CapB is looking for an experienced Azure Data and Devops engineer. This is 100% Remote position. Job description below. If interested rush your resume to us and let us know your absolute best rate on 1099. No Corp to Corp PRIMARY DUTIES  1 Create and maintain optimal data pipeline architecture.  2 Assemble large, complex data sets that meet functional / non-functional business requirements.  3 Identify, design, and implement internal process improvements: automating manual processes, optimizing","Dallas, TX, USA",Contract,Data Internship,31 days ,2024-04-03 03:12:50.528905,23 days ago ,,https://www.dice.com/company/10343479?companyname=CapB%20InfoteK%20LLC,146
ServiceNow Data + Integrations Architect,HL Solutions LLC,"Job Description:-  ServiceNow Data + Integrations Architect (Level 3) Primary Skill: Data + Integration Architect , CSA + at least 2 mainline certifications  ServiceNow Data Architect - 40% Govern demand for inbound/outbound data feed intake and delivery Collaboration point between platform, product, EA, and EDS teams to ensure data in ServiceNow is ""fit-for-purpose"" Ensure alignment of data model hierarchy to EA and EDS standards Govern quality and certification of data model Ensure implementat","Dallas, TX, USA","Contract, Third Party",Data Internship,17 days ,2024-04-17 03:12:50.528905,,,https://www.dice.com/company/91089103?companyname=HL%20Solutions%20LLC,146
Oracle HCM Platform Support (Techno-Functional) - Remote,Cyber Sphere LLC,"Job title: Oracle HCM Platform Support  (Techno-Functional) Remote - EST Long term Prior Experience of HCM Release Management for Oracle HCM components (EXTRACT, ALERT, BIP, Reports), Well versed with Oracle CSM & FSM tool for automated Release Management Prior experience of Managing Oracle POD, instance strategy, P2T, T2T, Data Masking Certificate Management for Real time Integrations. Experience generate, import, export, and delete PGP and X.509 certificates for data encryption and decryption","Dallas, TX, USA","Third Party, Contract",Data Internship,3 days ,2024-05-01 03:12:50.528905,,,https://www.dice.com/company/91081414?companyname=Cyber%20Sphere%20LLC,146
Technical Architect,ASCII Group LLC,"Position: Architect on Ingestion tools like HVR & Appflow Location: Remote Duration: Long Term Client: Pharma  Description: HVR Administration: Relevant Exp 5+ years HVR Tool Management:  Lead the configuration, administration, and management of the HVR tool, ensuring its optimal performance and adherence to industry best practices.Configure data source connections and manage HVR agents.Identify and raise system capacity related issues (storage, licenses, performance threshold).Participate in ov","Dallas, TX, USA","Third Party, Contract",Data Internship,3 days ,2024-05-01 03:12:50.528905,2 days ago ,,https://www.dice.com/company/10117479?companyname=ASCII%20Group%20LLC,146
Azure Data Engineer with Talend,StratG Inc,"Stratg Inc is looking for Azure Data engineer for our Direct Client in New York/New Jersey, Please share suitable profiles. Title: Azure Data engineer with Talend Location: NY/NJ Duration:  Longterm JD: -Strong Experience in Azure Data Engineer. -Strong ETL experience  -Talend Experience -Good Knowledge in Basic Java Interested People please share resume on my email  or you can reach me at","Dallas, TX, USA","Third Party, Contract",Data Internship,17 days ,2024-04-17 03:12:50.528905,,,https://www.dice.com/company/91138575?companyname=StratG%20Inc,146
Power BI Developer,Symphony Corporation,"Responsibilities: Quickly assimilate and extract relevant supply chain data from our extensive data lake.Develop, design, and maintain advanced Power BI reports and dashboards specific to supply chain metrics.Utilize complex data sources in a Supply Chain context, including but not limited to inventory levels, logistics performance, and vendor management.Transform raw data into meaningful insights through engaging visuals and interactive reports.Work closely with Supply Chain stakeholders to ide","Dallas, TX, USA",Contract,Data Internship,14 days ,2024-04-20 03:12:50.528905,,,https://www.dice.com/company/10115170?companyname=Symphony%20Corporation,146
SOLUTIONS ARCHITECT,TribolaTech Inc.,"15+ YEARS EXPERIENCE Responsibilities: Data Ingestion:Lead the design and development of data ingestion processes, extracting data from various sources and formats.Data Lake Architecture:Architect, implement, and maintain the data lake architecture, including landing, raw, and curated layers, ensuring efficient storage, processing, and retrieval of data.Staging Area Management:Establish and manage the staging area within the data lake, facilitating the consolidation and preparation of data befor","Dallas, TX, USA",Contract,Data Internship,11 days ,2024-04-23 03:12:50.528905,,,https://www.dice.com/company/10410723?companyname=TribolaTech%20Inc.,146
AI Consulting Lead - SVP,"ReQignition, Inc.","Company DescriptionBlend is a premier AI services provider, committed to co-creating meaningful impact for its clients through the power of data science, AI, technology, and people. With a mission to fuel bold visions, Blend tackles significant challenges by seamlessly aligning human expertise with artificial intelligence. The company is dedicated to unlocking value and fostering innovation for its clients by harnessing world-class people and data-driven strategy. We believe that the power of pe","Dallas, TX, USA",Full-time,Data Internship,24 days ,2024-04-10 03:12:50.528905,,,https://www.dice.com/company/90941004?companyname=ReQignition%2C%20Inc.,146
Data Science with ML,Astir IT Solutions,"Experience with Machine Learning, Data Science, Data Engineering principles and technologies such as R, Python, SQL. Experience delivering and managing AI/ML based software products. Experience with agile software development methodology. Proven experience with data engineering and ETL techniques using data from a wide variety of data sources. Rigorous understanding of statistics/machine learning and ability to discern appropriate analytics techniques to problem-solve. Knowledge of data warehous","Dallas, TX, USA",Contract,Data Internship,45 days ,2024-03-20 03:12:50.528905,12 hours ago ,,https://www.dice.com/company/10110032?companyname=Astir%20IT%20Solutions,146
SAP OTC consultant,Mahaugha LLC,"Job Description: Proficient in SAP OTC (Order to Cash) and integration with other SAP modules.Extensive experience with SAP S4 HANA transformations and migrations.Strong understanding of SAP ABAP/4 language for debugging and enhancing standard SAP applications.Exceptional ability in end-to-end implementation of SAP projects.Superior communication skills, both written and verbal for liaising with stakeholders at all levels to gatherrequirements and provide updates.Have experience with integration","Dallas, TX, USA",Contract,Data Internship,22 days ,2024-04-12 03:12:50.528905,16 days ago ,,https://www.dice.com/company/91114983?companyname=Mahaugha%20LLC,146
Remote Alteryx ETL developer Full time or Part time,CapB InfoteK LLC,"We have an immediate need for a strong Alteryx ETL Developer /Data Engineer to participate in  one of our Data Management Project . This is a 100% remote opportunity, but consultants need to have a place of residence anywhere in Wisconsin. Desired Experience:Using ETL tools to design ETL jobs (ETL 6 years, preferably 2 years of with Alteryx)Developing various types of data loads and Implementing change data capture (CDC)Testing and debugging ETL. Developing complex SQL. ETL job scheduling Loadin","Dallas, TX, USA",Contract,Data Internship,53 days ,2024-03-12 03:12:50.528905,23 days ago ,,https://www.dice.com/company/10343479?companyname=CapB%20InfoteK%20LLC,146
Principal Enterprise Architect-12 Months Contract-Remote opportunity.,Accion Labs,Greetings from Accionlabs!!  Our Direct client is looking for Principal Enterprise Architect-12 Months Contract-Remote opportunity.  Job Description: As Principal Architect - Enterprise you will drive world-class cloud solutions based on the AWS & Azure platform to accelerate the delivery of our customer facing expert solutions and improve the reliability & security of our applications. You will take a lead role in defining and promoting the architecture direction and governance for Cloud strate,"Dallas, TX, USA","Contract, Third Party",Data Internship,17 hours ,2024-05-03 10:12:50.528905,17 hours ago ,,https://www.dice.com/company/10428868?companyname=Accion%20Labs,146
Senior Data Analyst,Vy Systems,"Year of experience 10+Expert in SQLData warehousing conceptsData prep, ability to connect data across different sources to solve a problem.Critical thinking & Problem-solvingAttention to detail.Domain knowledge automotive finance or loan processingAbility to reverse engineer from Qlik sense, Alteryx, JCL s, Cobol code etc. to move on perm warehouse to Google Cloud Platform.Knowledge of Google Cloud Platform BigqueryTesting to catch issues before going to UAT.","Dallas, TX, USA","Contract, Third Party",Data Internship,24 days ,2024-04-10 03:12:50.528905,24 days ago ,,https://www.dice.com/company/10114746?companyname=Vy%20Systems,146
Mainframe Computer Operator II - Night Shift,Black Knight Inc,"SUMMARYResponsible for operating computer, computer-related hardware and other operations area equipment. Performs support activities in computer operations.  SHIFT Night Shift: 7:00pm - 7:00am ET Wednesday - Friday and every other Saturday.  This position can be 100% remote!  RESPONSIBILITIES Monitors and controls a computer console to process and complete jobs.Investigates error conditions in computer processing, equipment malfunction and/or network (on-line) performance in order to determine","Dallas, TX, USA",Full-time,Data Internship,60+ days ,2024-03-05 03:12:50.528905,29 days ago ,,https://www.dice.com/company/10361826?companyname=Black%20Knight%20Inc,146
