Machine Learning Engineer,Best High Technologies,"Job Description: We are seeking a talented Machine Learning Engineer with expertise in software engineering to join our team. As a Machine Learning Engineer, your primary responsibility will be to develop machine learning (ML) solutions that focus on technology process improvements. Specifically, you will be working on projects involving ML & Generative AI solutions for Technology & Data Management Efficiencies such as optimal cloud computing, knowledge bots, Software Code Assistants, Automatic","Dallas, TX, USA","Third Party, Contract",Data Scientist,13 hours ,2024-05-03 14:09:46.565866,13 hours ago ,,https://www.dice.com/company/90979221?companyname=Best%20High%20Technologies,135
ML Engineer,Best High Technologies,"Job Description: We are seeking a talented Machine Learning Engineer with expertise in software engineering to join our team. As a Machine Learning Engineer, your primary responsibility will be to develop machine learning (ML) solutions that focus on technology process improvements. Specifically, you will be working on projects involving ML & Generative AI solutions for Technology & Data Management Efficiencies such as optimal cloud computing, knowledge bots, Software Code Assistants, Automatic","Dallas, TX, USA","Contract, Third Party",Data Scientist,13 hours ,2024-05-03 14:09:46.565866,13 hours ago ,,https://www.dice.com/company/90979221?companyname=Best%20High%20Technologies,135
QNXT Claim Solutions Architect Lead,"Manage My Dream, LLC","Job position : QNXT Claim Solutions Architect Lead REMOTE VISA: ead NEED STRONG HEALTH EXPERIENCE Job Description: understands capitation models within the healthcare industry for all lines of business; understands how QNXT processes capitation; and will be able to help solution a capitation module that may leverage QNXT pieces but also supports an ""attribution"" model. Key responsibilities/qualifications for all positions include: Experience with commercial health plans; Able to conduct data ana","Dallas, TX, USA","Third Party, Contract",Data Scientist,9 days ,2024-04-25 03:09:46.566866,,,https://www.dice.com/company/90979421?companyname=Manage%20My%20Dream%2C%20LLC,135
"Statistical Analysis System (SAS AML 4.2) - Toronto, Canada",Skysoft Inc,"Skills and Qualifications: Proven experience (3-5 years) in developing and implementing AML scenarios within the SAS AML 4.2 platform.In-depth knowledge of anti-money laundering concepts, regulations, and typologies.Strong proficiency in SAS programming, specifically for AML scenario development.Experience with data analysis and SQL queries for data extraction and manipulation.Familiarity with other AML technologies and tools is a plus (Actimize, Mantas, etc.).","Dallas, TX, USA","Contract, Third Party",Data Scientist,3 days ,2024-05-01 03:09:46.567866,3 days ago ,,https://www.dice.com/company/91131645?companyname=Skysoft%20Inc,135
Tester/QA,"Digitek Software, Inc.","One of our clients is looking for the position of  Tester  based on following skills. The Tester is member of team which plans, constructs, and executes product tests, system tests, unit tests, load tests, volume tests, network tests as well as works with others for release control processes.100% Remote. No equipment provided. Tester 2 The Tester is a member of a team which plans, constructs, and executes product tests, system tests, unit tests, load tests, volume tests, network tests as well as","Dallas, TX, USA","Third Party, Contract",Data Scientist,14 hours ,2024-05-03 13:09:46.567866,,,https://www.dice.com/company/digitek?companyname=Digitek%20Software%2C%20Inc.,135
Rhapsody EDI,Genome International Corp,"Job Description: As an EDI (Electronic Data Interchange) Software Developer specializing in Rhapsody and HL7, you will play a key role in designing, implementing, and maintaining EDI solutions tailored specifically for healthcare organizations. Your expertise in Rhapsody integration engine and HL7 standards will be essential in ensuring seamless data exchange between healthcare systems, improving interoperability, and enhancing patient care delivery. Responsibilities: Utilize Rhapsody integratio","Dallas, TX, USA",Contract,Data Scientist,2 days ,2024-05-02 03:09:46.568866,1 day ago ,,https://www.dice.com/company/genwi001?companyname=Genome%20International%20Corp,135
WEB Analyst,Galax-Esystems Corp,"Web Analyst Local candidates in NJ/NY area are preferred. We can consider remote candidates who are willing to travel as well. Start Date: ASAP Required skills: * 5+ years of architecture experience within the digital web space * 5+ years  experience successfully leading cross functional teams and driving digital web projects from concept to launch * Experience documenting data model and flow diagrams * Advanced knowledge of web hosting technologies (.NET, Java, JavaScripting) and B2B with consu","Dallas, TX, USA","Contract, Third Party",Data Scientist,2 days ,2024-05-02 03:09:46.569866,,,https://www.dice.com/company/10230239?companyname=Galax-Esystems%20Corp,135
LLM Hardware Design Developer,Efovinity Inc,"NO USC/ CANADA, ONLY INDIANS/ AFRICA100% REMOTE NO USC/ CANADA, ONLY INDIANS/ AFRICAExperience: 4+ YEARS Elevate hardware design's LLMs as a hardware design Developer  We're searching for an exceptional hardware design Developer to play a pivotal role in using the hardware design platform to generate the training data to enhance enterprise LLMs' capabilities. This unique position offers the chance to directly contribute to the sophistication of enterprise LLMs, ensuring they operate with unparal","Dallas, TX, USA","Third Party, Contract",Data Scientist,8 days ,2024-04-26 03:09:46.569866,2 days ago ,,https://www.dice.com/company/91156797?companyname=Efovinity%20Inc,135
Oracle HCM Platform Support JD-- (Techno-Functional),Cyber Sphere LLC,"Oracle HCM Platform Support JD-- (Techno-Functional) Remote Long Term Contract Prior Experience of HCM Release Management for Oracle HCM components (EXTRACT, ALERT, BIP, Reports), Well versed with Oracle CSM & FSM tool for automated Release ManagementPrior experience of Managing Oracle POD, instance strategy, P2T, T2T, Data MaskingCertificate Management for Real time Integrations. Experience generate, import, export, and delete PGP and X.509 certificates for data encryption and decryptionExperie","Dallas, TX, USA","Contract, Third Party",Data Scientist,3 days ,2024-05-01 03:09:46.570866,1 day ago ,,https://www.dice.com/company/91081414?companyname=Cyber%20Sphere%20LLC,135
OneTrust Consultant,VLink Inc,"Role: OneTrust Developer Location : Remote Duration : Long Term 5+ years of OneTrust development experience (OneTrust Certification Preferred) Configure and support DPIA/PIA/Data mapping/Vendor risk management, and Cookie Management solutions. Proficient in Designing and configuring on OneTrust Experience developing privacy solutions within OneTrust which would include designing/creating/optimizing complex assessment templates, workflows, and/or Incident and data attributes. Ability to customize","Dallas, TX, USA","Contract, Third Party",Data Scientist,16 days ,2024-04-18 03:09:46.571905,,,https://www.dice.com/company/RTL109178?companyname=VLink%20Inc,135
Postgres Developer,Vy Systems,"10+ years of Postgres database development experience in various phases of software development including Analysis, Design, Development, Testing and Implementation.Experience of Postgres version 9 and above (Open Source version or EDB or Percona Postgres flavor)Candidate should be able to independently and implement data models.Solid Postgres SQL development experience using PL/pgSQLKnowledge and experience of database development using Oracle SQL PLSQL will be added advantages.Strong experience","Dallas, TX, USA","Contract, Third Party",Data Scientist,8 days ,2024-04-26 03:09:46.571905,7 days ago ,,https://www.dice.com/company/10114746?companyname=Vy%20Systems,135
BI Developer with SQL and SAP CDS views,VRIT Tech Inc,"10 years experience as SQL Developer with Power BIExperience with SQL Server Reporting Services and SQL Server Analysis Services, Extensive expertise in configuring security measures, overseeing workspace management, and managing data flows within Power BI, encompassing both desktop and Power BI service, with over 3 years of experience.  Strong understanding of SAP HANA Views and setting up connection with SAP HANA views. Proficient in Power Query and M language, having utilized these tools for","Dallas, TX, USA",Part-time,Data Scientist,1 day ,2024-05-03 03:09:46.572902,,,https://www.dice.com/company/91157206?companyname=VRIT%20Tech%20Inc,135
EDI Software Developer | Remote,GSSR,"EDI Software Developer (Specializing in Rhapsody and HL7)  Nashville, TN| Remote  As an EDI (Electronic Data Interchange) Software Developer specializing in Rhapsody and HL7, you will play a key role in designing, implementing, and maintaining EDI solutions tailored specifically for healthcare organizations. Your expertise in Rhapsody integration engine and HL7 standards will be essential in ensuring seamless data exchange between healthcare systems, improving interoperability, and enhancing pat","Dallas, TX, USA","Contract, Third Party",Data Scientist,1 day ,2024-05-03 03:09:46.573886,,,https://www.dice.com/company/10358134?companyname=GSSR,135
ABAP Developer,"HSK Technologies, Inc.","Job Summary: As an ABAP Developer with IS-U billing rates technical expertise, you will design, develop, and maintain SAP applications specifically in the IS-U module. Your primary focus will be on implementing and optimizing billing rates and processes to ensure efficient and accurate utility billing. You will collaborate with business analysts, project managers, and other developers to deliver high-quality solutions that meet the organization's goals.  Key Responsibilities: Design, develop, an","Dallas, TX, USA",Contract,Data Scientist,8 days ,2024-04-26 03:09:46.573886,1 day ago ,,https://www.dice.com/company/91086948?companyname=HSK%20Technologies%2C%20Inc.,135
EDI Software Developer (Specializing in Rhapsody and HL7),Intellisoft Technologies,"Job Title: EDI Software Developer (Specializing in Rhapsody and HL7)  100% remote C2C is okay Job Description: As an EDI (Electronic Data Interchange) Software Developer specializing in Rhapsody and HL7, you will play a key role in designing, implementing, and maintaining EDI solutions tailored specifically for healthcare organizations. Your expertise in Rhapsody integration engine and HL7 standards will be essential in ensuring seamless data exchange between healthcare systems, improving intero","Dallas, TX, USA","Third Party, Contract",Data Scientist,4 days ,2024-04-30 03:09:46.574900,2 days ago ,,https://www.dice.com/company/intelsft?companyname=Intellisoft%20Technologies,135
129813: - Lead Business Analyst,"Key Business Solutions, Inc.","129813: - Lead Business Analyst Remote 12 Months Need 3 Reference at the submission Job Description: This position will require a qualified Technical Business Analyst to take the lead in the following tasks: Ability to create and document detailed business requirements, perform analysis, outlining problems, opportunities and solutions for the stakeholders Author and update internal and external documentation, and formally initiate and deliver requirements and documentation A strong understanding","Dallas, TX, USA","Full-time, Third Party",Data Scientist,4 days ,2024-04-30 03:09:46.574900,,,https://www.dice.com/company/RTL149247?companyname=Key%20Business%20Solutions%2C%20Inc.,135
Google Cloud Platform Data Engineer,"Amzur Technologies, Inc.",Develop and operate data management tools  monitoring data flows  data quality  data cleansing and data processingCreate and document logical data integration strategies for data flows between disparate systems and the enterprise data warehouse data lakesCollaborate with different stakeholders  engineers  data stewards  to collect required data from internal and external systemsWork in an Agile environment that focuses on collaboration and teamworkImprove and extend existing data infrastructure,"Dallas, TX, USA",Contract,Data Scientist,50 days ,2024-03-15 03:09:46.575900,15 hours ago ,,https://www.dice.com/company/10115656?companyname=Amzur%20Technologies%2C%20Inc.,135
Senior Saviynt Developer,Accolite Digital LLC,"Bounteous x Accolite makes the future faster for the world's most ambitious brands. Our services span Strategy, Analytics, Digital Engineering, Cloud, Data & AI, Experience Design, and Marketing. We are guided by Co-Innovation, our proven methodology of collaborative partnership. Bounteous x Accolite brings together 5000+ employees spanning North America, APAC, and EMEA, and partnerships with leading technology providers. Through advanced digital engineering, technology solutions, and data-drive","Dallas, TX, USA","Contract, Third Party",Data Scientist,9 days ,2024-04-25 03:09:46.576900,,,https://www.dice.com/company/10300908?companyname=Accolite%20Digital%20LLC,135
AWS Data Engineer -Remote,Cyma Systems Inc,"Title:  AWS EngineerLocation:  Remote Duration: 6+months . We re Looking for: Minimum 7 years of progressively responsible work experience in Data Engineering , architecture, design and development. Minimum 5 years of experience with ETL/ELT design and development using tools like IICS, AWS Glue, Talend, Databricks, Oracle Data Integrator (ODI) or equivalent.  Minimum 5 years of experience in database architecture using relational SQL (e.g. Snowflake, Oracle, PostgreSQL, MySQL), and NoSQL (Dynam","Dallas, TX, USA",Contract,Data Scientist,23 days ,2024-04-11 03:09:46.576900,13 hours ago ,,https://www.dice.com/company/RTL327349?companyname=Cyma%20Systems%20Inc,135
Machine Learning Operations (MLOps) Engineer Remote Rate $50/hr on C2C,"ICS Global Soft, Inc.","Role: Machine Learning Operations (MLOps) Engineer . Proficiency in data science tools such as Pandas, Notebooks, Numpy, Scipy.Experience with both relational and non-relational databases.Strong track record of fine-tuning, running large-scale training jobs, and managing model servers.","Dallas, TX, USA",Contract,Data Scientist,4 days ,2024-04-30 03:09:46.577900,,,https://www.dice.com/company/90962964?companyname=ICS%20Global%20Soft%2C%20Inc.,135
SAP APM (Advanced Payment Management) SME,Trail Blazer Consulting LLC,"Title: SAP Advanced Payment Management SME Location: Remote with Travel To Orlando, FL Duration: 6 month Interview: Video LinkedIn with pic. 2 Managerial references Description: Design and configure payment on behalf of (PBO) processes for US entities within the US SAP instance. Create and maintain APM/IHB master data. Update Accounts Payable (AP) Business Partner/Vendor data to align with the go-live date. Develop and implement WRICEF objects to meet reporting requirements. Conduct end-to-end t","Dallas, TX, USA","Contract, Third Party",Data Scientist,18 hours ,2024-05-03 09:09:46.578901,,,https://www.dice.com/company/91093714?companyname=Trail%20Blazer%20Consulting%20LLC,135
Java with GraphQL,Best High Technologies,"Must have 7+ years of experience in backend development and 3yr of GraphQL API DevSolid understanding of algorithms and data structures, knowledge of object-oriented design, Design Patterns, and multi-threaded programmingStrong OOP skills, with the ability to analyze requirements and transform them into scalable software designs.Hands-on Java Programming Expertise (Core Java, J2EE, Spring framework)","Dallas, TX, USA","Contract, Third Party",Data Scientist,13 hours ,2024-05-03 14:09:46.578901,13 hours ago ,,https://www.dice.com/company/90979221?companyname=Best%20High%20Technologies,135
SAP IBP Planning Consultant,Techwaukee,"SAP IBP Planning Consultant HIGH| 3 Months | Contract | Remote | Atlanta , Georgia , United StatesJob DescriptionStarting as 40% utilization until July and then 100% from July.  Length: 3 months + 100% Extensions for further 1 year Location: Working REMOTE with small amount of travel to the USA  Details of project Planning/IBP: IBP experience with focus on S&OP and Demand planningStrong business acumen to manage and drive the organization through change from an excel based planning to a data dri","Dallas, TX, USA","Contract, Third Party",Data Scientist,1 day ,2024-05-03 03:09:46.579900,21 hours ago ,,https://www.dice.com/company/91128441?companyname=Techwaukee,135
GenAI Cloud Engineer/MLOps Engineer,CrackaJack Digital Solutions,"We are seeking a highly skilled Senior Cloud Engineer with expertise in provisioning AI resources on the Azure platform (or Google Cloud Platform). The ideal candidate will have extensive experience in deploying and managing AI/ML solutions while adhering to enterprise security standards. Additionally, familiarity with GenAI architecture and other cloud providers' AI/ML offerings is highly desirable. Key Responsibilities: Provision and automate cloud infrastructure/platforms to support AI resour","Dallas, TX, USA","Contract, Third Party",Data Scientist,17 days ,2024-04-17 03:09:46.580886,,,https://www.dice.com/company/91021502?companyname=CrackaJack%20Digital%20Solutions,135
Java Developer,Best High Technologies,"Job Description: Bachelor s and/or Master s degree, preferably in CS, or equivalent experience5+ years of Payments industry experienceLeading role in the design, implementation, and deployment of one or more high scale, cross-functional payment systems.Leading role in initiatives that span across teams or departments.Independent, dedicated, and able to deliver production ready code with minimal guidanceDeep understanding of async programming models (events, callbacks, promises, async/await).Expe","Dallas, TX, USA","Third Party, Contract",Data Scientist,13 hours ,2024-05-03 14:09:46.580886,13 hours ago ,,https://www.dice.com/company/90979221?companyname=Best%20High%20Technologies,135
Lead Java Developer,Best High Technologies,"Job Description: Bachelor s and/or Master s degree, preferably in CS, or equivalent experience5+ years of Payments industry experienceLeading role in the design, implementation, and deployment of one or more high scale, cross-functional payment systems.Leading role in initiatives that span across teams or departments.Independent, dedicated, and able to deliver production ready code with minimal guidanceDeep understanding of async programming models (events, callbacks, promises, async/await).Expe","Dallas, TX, USA","Third Party, Contract",Data Scientist,13 hours ,2024-05-03 14:09:46.581900,13 hours ago ,,https://www.dice.com/company/90979221?companyname=Best%20High%20Technologies,135
ServiceNow Project Manager,DVG Tech Solutions LLC,"Independent Contractors are encouraged to apply for these roles. Key Skills Required 10+ years of Project Management experience.Experience deploying ITSM processes in a ServiceNow environment.Experience working with virtual teams across multiple regions.Experience in managing the critical aspects of enterprise application/process transition projects, from requirements, to design, to development, to test, to change control, to release, and to support.Ability to quickly grasp the strategic, tactic","Dallas, TX, USA","Contract, Third Party",Data Scientist,2 days ,2024-05-02 03:09:46.582900,19 hours ago ,,https://www.dice.com/company/90922892?companyname=DVG%20Tech%20Solutions%20LLC,135
Dell Boomi Architect,SelSoft Inc.,"Hi, Greeting From SelsoftINC, Role: Dell Boomi Architect Location: Philadelphia PA (remote/Hybrid) JD: Hands on deployment, maintenance, and administration of integration processes between applications across cloud and/or on-premises using Dell Boomi AtomSphere platform (Cloud Integration, Application Integration and Enterprise web services APIs)Managing, Monitoring, Sustaining, Troubleshooting, and supporting existing SOA Architecture and Dell Boomi AtomSphere platformDesign Service Oriented an","Dallas, TX, USA","Contract, Third Party",Data Scientist,2 days ,2024-05-02 03:09:46.582900,,,https://www.dice.com/company/10307276?companyname=SelSoft%20Inc.,135
SAP BPC Solution Architect,VLink Inc,"Title: SAP BPC Solution Architect Location: Kalamazoo, MI (Remote) Participate in requirement gathering and design phase to define business requirements and system blueprint designBuild SAP BPC model & dimensionPerform SAP BPC system configuration such as business process flow and business rules.Development and support of all BPC objects that includes reports, input templates, master/meta data, logic scripts, business rules, BPF, work status, batch schedulesWrite code in Script Logic / Fox and A","Dallas, TX, USA","Third Party, Contract",Data Scientist,10 days ,2024-04-24 03:09:46.583900,,,https://www.dice.com/company/RTL109178?companyname=VLink%20Inc,135
Looking for NetSuite OpenAir Consultant,Xoriant Corporation,"Looking for NetSuite OpenAir Consultant Remote role Responsibilities: Implementation and Configuration: Lead the implementation of NetSuite OpenAir for clients, including requirements gathering, solution design, configuration, and testing.Customize OpenAir to meet client-specific business processes and requirements.Qualifications: Bachelor s degree in Business Administration, Information Technology, or a related field.Proven experience implementing and configuring NetSuite OpenAir for clients.St","Dallas, TX, USA","Full-time, Third Party",Data Scientist,3 days ,2024-05-01 03:09:46.584900,18 hours ago ,,https://www.dice.com/company/xorca001?companyname=Xoriant%20Corporation,135
