ServiceNow Developer,CrackaJack Digital Solutions,"Plano, TX, Columbus, OH & Wilmington, DE Job responsibilities: Executes software solutions, design, development, and technical troubleshooting with ability to think beyond routine or conventional approaches to build solutions or break down technical problems Creates secure and high-quality production code and maintains algorithms that run synchronously with appropriate systems Produces architecture and design artifacts for complex applications while being accountable for ensuring design constrai","Dallas, TX, USA","Contract, Third Party",Data Internship,1 day ,2024-05-03 03:12:50.528905,,,https://www.dice.com/company/91021502?companyname=CrackaJack%20Digital%20Solutions,146
ETL ODI Developer,P2PSoftTek Inc,"ETL ODI Developer Remote Role  Description  ODI Experience Proficient in PL SQL, Oracle SQL Plusses SSIS experience - OBI: Operations business intelligence - Data analytics/data science - Business IT unit - Why? We sit in business and provide analytics solution to the business - Most of work supports electric ops and working with field crews, office, working with EMS data, ATMS, GIS, SAP, all sorts of data sets 70 different data sets analytics on data - Oracle based technology stack - Solutions","Dallas, TX, USA","Contract, Third Party",Data Internship,60+ days ,2024-03-05 03:12:50.528905,19 hours ago ,,https://www.dice.com/company/90868495?companyname=P2PSoftTek%20Inc,146
Consulting Director - Digital Transformation (remote),RedRiver Systems L.L.C.,"Great opportunity within growing international company developing state-of-the-art products supporting IoT and communication systems worldwide. This is a hands-on opportunity working with customers creating Digital Transformation solutions to drive their Overall Equipment Effectiveness. RESPONSIBILITIES Identify, prioritize, frame and structure complex and ambiguous challenges to help clients build realistic and scalable digital strategies that meet their company specific needs.Lead Digital Tran","Dallas, TX, USA",Full-time,Data Internship,9 days ,2024-04-25 03:12:50.528905,20 hours ago ,,https://www.dice.com/company/10122941?companyname=RedRiver%20Systems%20L.L.C.,146
AI Engineer - Open Source Models Specialist,P2PSoftTek Inc,"AI Engineer - Open Source Models Specialist Remote Description :  1. Research, develop, and implement state-of-the-art AI models using open source frameworks and tools, with a focus on Hugging Face Datasets. 2. Fine-tune pre-trained models to specific tasks and domains, ensuring optimal performance and accuracy. 3. Build and optimize NLP encoders and transformers to support various natural language processing tasks and applications. 4. Design and maintain a scalable vector database for efficient","Dallas, TX, USA","Contract, Third Party",Data Internship,7 days ,2024-04-27 03:12:50.528905,19 hours ago ,,https://www.dice.com/company/90868495?companyname=P2PSoftTek%20Inc,146
ServiceNow Developer,Info Dinamica Inc,"Must Have:  Certifications verified Minimum two (Certification Verification email require from suppliers)Role verified Should be part of core development and Implementation team. Done scripting and Rest API based integrations.Understand converting a Business Requirements to a workflow and implement the same.HR Service Delivery module experienceService portal experience.Job responsibilities Executes software solutions, design, development, and technical troubleshooting with ability to think beyon","Dallas, TX, USA",Contract,Data Internship,3 days ,2024-05-01 03:12:50.528905,,,https://www.dice.com/company/91091604?companyname=Info%20Dinamica%20Inc,146
Sales Intern (IT),RisamSoft Inc,"Duration: 3-6 months, with potential for long-term conversion. Job Description: We are a rapidly growing technology company looking for an enthusiastic and driven Sales Intern to join our dynamic sales team. This position offers the opportunity to gain firsthand experience in sales and marketing strategies, customer relationship management, and the fast-paced environment of a tech startup. The ideal candidate is a motivated individual with a passion for technology and an eagerness to learn and c","Dallas, TX, USA",Full-time,Data Internship,19 days ,2024-04-15 03:12:50.528905,19 days ago ,,https://www.dice.com/company/91112109?companyname=RisamSoft%20Inc,146
Lead Salesforce Developer,Incedo Inc,"Position: Salesforce Technical Lead  Location: Pittsburgh, PA (remote) Duration: Full time As a Salesforce Lead with expertise in Experience Cloud, Service Cloud, and Marketing Cloud, you will play a critical role in the design, development, and maintenance of our client s Salesforce ecosystem. Must have experience in working with globally distributed teams and agile delivery. You will collaborate with cross-functional teams to implement and optimize solutions that enhance customer experiences,","Dallas, TX, USA",Full-time,Data Internship,3 days ,2024-05-01 03:12:50.528905,,,https://www.dice.com/company/10476889?companyname=Incedo%20Inc,146
Sr. Java Developer - Hybrid Role - Dallas/TX,CoppelTech,"Looking for a Mid-Sr level Java developer with atleast 8 years of experience for a Banking Client with following skills :- Responsibilities: Design, develop, and maintain high-quality Java applications and services.Collaborate with product owners, business analysts, and other stakeholders to gather and refine requirements.Translate business requirements into technical specifications and architectural designs.Implement best practices for software development, including code reviews, testing, and","Dallas, TX, USA","Third Party, Contract",Data Internship,7 days ,2024-04-27 03:12:50.528905,,,https://www.dice.com/company/91141956?companyname=CoppelTech,146
Tricentis Tosca Neoload Architect,SumasEdge Corporation,"We are seeking a skilled and experienced Tricentis Tosca & NeoLoad Architect to join our dynamic team. The ideal candidate will have a strong background in software testing, particularly in test automation using Tricentis Tosca, as well as performance testing using NeoLoad. This role will involve designing, implementing, and optimizing test automation and performance testing solutions to ensure the quality and scalability of our software products.  Responsibilities:  Design and implement test au","Dallas, TX, USA","Third Party, Contract",Data Internship,23 days ,2024-04-11 03:12:50.544550,16 hours ago ,,https://www.dice.com/company/90859492?companyname=SumasEdge%20Corporation,146
Service Now Developer @W2,Globex IT Solutions INC,"Job Title: Service Now Developer Experience: 6 to 12+ Years Location: Wilmington DE, Columbus OH, Plano TX (Non-Locals are fine for Contractors) Duration: Long Term Job Description: Certifications verified Minimum two (Certification Verification email require from suppliers)Role verified Should be part of core development and Implementation team. Done scripting and Rest API based integrations.Understand converting a Business Requirements to a workflow and implement the same.HR Service Delivery m","Dallas, TX, USA",Full-time,Data Internship,3 days ,2024-05-01 03:12:50.544550,20 hours ago ,,https://www.dice.com/company/91135097?companyname=Globex%20IT%20Solutions%20INC,146
Fullstack Developer (W2/1099),ResolveTech Solutions Inc.,"5+ years of experience with backend frameworks (node.js, NestJS)5+ years of solid foundation and understanding of relational and NoSQL database principles.5+ years of experience with AWS Cloud Services5+ years of experience in creating API using NodeJS, Python, Java, or Go developing software solutions for real world problems (Recent experience in NodeJS required)5+ years of experience with microservices or SOA Architecture and other design patternsExperience working with Confluent Kafka, Kafka","Dallas, TX, USA",Contract,Data Internship,29 days ,2024-04-05 03:12:50.544550,,,https://www.dice.com/company/10368525?companyname=ResolveTech%20Solutions%20Inc.,146
Sales Leader - Insurance,"IRIS Software, Inc.","About IRIS Software Inc. IRIS Software Inc. ( has a proven legacy of over 3 decades in helping our enterprise clients thrive with technology-enabled transformation across Banking, Financial Services, Insurance, Life Sciences, Healthcare, Professional Services, Manufacturing, Transportation, and Logistics sectors. Our services cover core, complex, mission-critical Application and Product Engineering, Data and Analytics, Cloud Engineering, DevSecOps, Quality Engineering, UX transformation, and Bus","Dallas, TX, USA","Full-time, Third Party",Data Internship,60+ days ,2024-03-05 03:12:50.544550,8 days ago ,,https://www.dice.com/company/irissoft?companyname=IRIS%20Software%2C%20Inc.,146
Pear Script Developer,SelSoft Inc.,"Hi Thara, Greetings from Selsoft Inc!! Role: Perl Script developer Location: Plano, TX (Day 1 Onsite) Duration: Contract Looking for 6-8 Yrs of Perl/Shell Scripting development experience. Participating in planning the software architecture of new systems spanning multiple teams and platforms Unix or Linux command Line Deliver high quality, scalable code to solve both tactical and strategic problems. Analysis of requirements, high level and detailed design, integration, and implementation activi","Dallas, TX, USA","Third Party, Contract",Data Internship,7 days ,2024-04-27 03:12:50.544550,,,https://www.dice.com/company/10307276?companyname=SelSoft%20Inc.,146
Software Engineer in Test - Playwright with Typescript,Vidorra Consulting Group,"Visa Sponsorship is available for this opportunity. Our reputed client based out of the Houston area is seeking for multiple Sr. Full Stack Quality Engineer with strong hands-on Manual testing experience on cloud-based infrastructure and services in Serverless, Event driven architectures on Azure cloud. Deep understanding and problem-solving ability of various complexities, experience collaborating on teams with multiple disciplines (DevOps, Data engineers, Software engineers). Self-organized an","Dallas, TX, USA",Full-time,Data Internship,60+ days ,2024-03-05 03:12:50.544550,8 days ago ,,https://www.dice.com/company/RTX1a5d37?companyname=Vidorra%20Consulting%20Group,146
"ServiceNow Architect field service module mandatory , Remote",Spiceorb,"Hi, This is Upasna from Spiceorb.we have opening for Servicenow Architect role.If you are available and interested send your updated resume to  ServiceNow Architect, remote role The ServiceNow Architect plays a critical role in the design, implementation, and optimization of ServiceNow solutions within the organization.This position requires a deep understanding of the ServiceNow platform, IT service management processes, and business requirements to architect solutions that drive efficiency, au","Dallas, TX, USA","Contract, Third Party",Data Internship,9 days ,2024-04-25 03:12:50.544550,7 days ago ,,https://www.dice.com/company/91109480?companyname=Spiceorb,146
Automation Architect,Qualibar,"Job Title: Automation Architect Position: Full Time Client: PWC Location: Remote//Remote/Hybrid  Description: Experience in creation of application specific test strategy and Automation test plan Expertise in creation / maintenance of Test Automation framework (Hybrid / TDD / BDD) from scratch Expertise in creation of API / UI Automated test scripts using Selenium with Java & RestAPI/SoapUI  Exposure and experience in Katalon, Parasoft and Azure ADO are added advantage Hands on experience in del","Dallas, TX, USA",Full-time,Data Internship,60+ days ,2024-03-05 03:12:50.544550,19 hours ago ,,https://www.dice.com/company/91132260?companyname=Qualibar,146
Kafka Admin,Galax-Esystems Corp,"Role Kafka Tech Admin Location: Remote Duration:6-12 Months Job Responsibility Primary responsibility of Confluent Platform Administrator will be to build, test and maintain Kafka Cluster and its eco-system which is deployed to run Data Streaming use cases for various business units Experience Overall 5+ years of experience out of which 2+ years around Confluent Platform administration Mandatory Job Requirements Manage single and multi-node Kafka cluster deployed on VM, Docker and Kubernetes Con","Dallas, TX, USA","Contract, Third Party",Data Internship,13 hours ,2024-05-03 14:12:50.544550,,,https://www.dice.com/company/10230239?companyname=Galax-Esystems%20Corp,146
Sr Java Developer,Caprus IT Inc.,"Job Title: Sr. Java Developer or Full Stack Java/React developer. Location: Frisco, TX (Onsite) Duration: Contract (W2) / Fulltime 10+ Years of IT Experience is must  Roles and Responsibilities Writing well-designed, testable, and efficient code.Providing code documentation and other inputs to technical documents.Supporting continuous improvement by investigating alternatives and new technologies and presenting these for architectural review.Troubleshooting and debugging to optimize performance.","Dallas, TX, USA",Full-time,Data Internship,16 days ,2024-04-18 03:12:50.544550,14 hours ago ,,https://www.dice.com/company/10297302?companyname=Caprus%20IT%20Inc.,146
Jr. UI Developer (entry level/Intern) 1 to 3 years of experience.,New Jersey Tech Systems LLC,"New Jersey Tech Systems is a leader in the industry by offering high-technology solutions that save on overall time and cost. We do this by providing scalable support for clients entire project needs that are effective, affordable, and easy to understand. - Location: Princeton, NJ - Salary: $50,000 - $60,000. - Visa sponsorship is available for qualified employees. - *No experience is required but better to have. - 100% remote. - Contact details: | Knowledge and Skills: Exposed to and/or experie","Dallas, TX, USA",Full-time,Data Internship,4 days ,2024-04-30 03:12:50.544550,4 days ago ,,https://www.dice.com/company/90979221b?companyname=New%20Jersey%20Tech%20Systems%20LLC,146
Full-Stack Developer (entry level/Intern) 1 to 3 years of experience.,New Jersey Tech Systems LLC,"New Jersey Tech Systems is a leader in the industry through offering high-technology solutions that save on overall time and cost. We do this by providing scalable support for clients' entire project needs that are effective, affordable, and easy to understand. Location: Princeton, NJ. Salary: $50,000 - $60,000 Visa sponsorship is available for qualified employees. *No experience is required but better to have. - 100% remote. - Contact details: | Knowledge and Skills Knowledge of creating front-","Dallas, TX, USA",Full-time,Data Internship,4 days ,2024-04-30 03:12:50.544550,4 days ago ,,https://www.dice.com/company/90979221b?companyname=New%20Jersey%20Tech%20Systems%20LLC,146
"MS SQL Developer (SSIS/ SSRS) -Dallas/ Plano, TX- contract(Onsite)",Apexon,"MS SQL Developer (SSIS/ SSRS) -Dallas/ Plano, TX- contract (Onsite)  The Database Developer will be responsible for creating and maintaining database software to meet functional, performance, and availability goals. Additionally, the developer will be expected to support peers, follow standards, and make technical recommendations. ESSENTIAL DUTIES AND RESPONSIBILITIES include the following.  Other duties and tasks may be assigned. Perform in an independent capacity and set a strong example for o","Dallas, TX, USA","Contract, Third Party",Data Internship,1 day ,2024-05-03 03:12:50.544550,,,https://www.dice.com/company/tecnos?companyname=Apexon,146
big data engineer,Lincoln Softtech LLC,"ob Title:Azure Data Engineer Onsite - Dallas,TX and Chicago,IL Need Only Locals  Send 12+ Profiles only  Experience working with and extracting value from large, disconnected and/or unstructured datasets Demonstrated ability to build processes that support data transformation, data structures, metadata, dependency and workload management Strong interpersonal skills and ability to project manage and work with cross-functional teams Advanced working SQL knowledge and experience working with relati","Dallas, TX, USA","Third Party, Contract",Data Internship,15 days ,2024-04-19 03:12:50.544550,4 days ago ,,https://www.dice.com/company/91138517?companyname=Lincoln%20Softtech%20LLC,146
Java Microservices Lead/Developer,Photon Interactive UK Limited,"Greeting Everyone! Hope you are staying safe. We are looking for a Java Microservices Lead/Developer to join our digital platform team for new initiatives. Who are we? For the past 20 years, we have powered many Digital Experiences for the Fortune 100. Since 1999, we have grown from a few people to more than 5000 team members across the globe that are engaged in various Digital Modernization. For a brief 1 minute video about us, you can check ;/p>What are we looking for? A candidate should have","Dallas, TX, USA",Full-time,Data Internship,11 days ,2024-04-23 03:12:50.544550,9 days ago ,,https://www.dice.com/company/10462843?companyname=Photon%20Interactive%20UK%20Limited,146
Mid Level. Java Developer - Remote,CoppelTech,"Looking for a Mid level Java developer with atleast 6 years of experience on following skills :- Responsibilities: Design, develop, and maintain high-quality Java applications and services.Collaborate with product owners, business analysts, and other stakeholders to gather and refine requirements.Translate business requirements into technical specifications and architectural designs.Implement best practices for software development, including code reviews, testing, and documentation.Troubleshoot","Dallas, TX, USA","Contract, Third Party",Data Internship,4 days ,2024-04-30 03:12:50.544550,,,https://www.dice.com/company/91141956?companyname=CoppelTech,146
Strategic Sales Lead,RisamSoft Inc,"As the Strategic Sales Lead, you will oversee the entire sales cycle, from pipeline creation and opportunity qualification to securing deals with new clients tailored to the industry. Working closely with our leadership, advisory team, and technical experts, you will devise strategies to ensure optimal outcomes throughout the sales process. Key Duties and Responsibilities: Collaborate with leadership, technical teams, and advisors to develop a sales strategy that exceeds targets, builds a robust","Dallas, TX, USA",Full-time,Data Internship,19 days ,2024-04-15 03:12:50.544550,,,https://www.dice.com/company/91112109?companyname=RisamSoft%20Inc,146
Data Engineer (8 Openings),Trigint Solutions,"Required Skills:  +10 years in Data Engineering and Analytics Expertise in data analytical skills and handling big data along with real time streaming. Graph Ontology and semantic modeling with GraphQL or SPARQL experience is a must Proactive, self-driven, works independently and collaborates well. Expertise in Python, Pyspark Use of databricks is a must.","Dallas, TX, USA",Contract,Data Internship,2 days ,2024-05-02 03:12:50.544550,,,https://www.dice.com/company/90999304?companyname=Trigint%20Solutions,146
Data Scientist with Gen AI,Photon Interactive UK Limited,"Responsibilities: Hands on with LLMs (In previous projects) and worked on product development using LLMsExperience with Chat, IVR, Banking will be plusExp with Speech to Text using Whisper/Google TTS etc.,Handson experience with Vector Database & Graph DB (Pinecone, Milvus, Neo4j)Good understanding and experience using Transformer/Neural Network modelHands on experience using Open AI APIs, Open Source LLMs (Llama2, Mistral, Mixtral etc.,)Solid understanding on framework like Langchain, Haystack","Dallas, TX, USA",Full-time,Data Internship,1 day ,2024-05-03 03:12:50.544550,,,https://www.dice.com/company/10462843?companyname=Photon%20Interactive%20UK%20Limited,146
Python Developer - Tampa / Dallas - 3 days in office,Marlabs LLC,"Please email me your resumes @  ()or call me on my cell . Job Title: Python Developer Location: Dallas / Tampa  Duration: 6-12 months extendable  Job Description:  Build new applications with Python as the core in the AWS environmentRe-platform existing applications to a modern technology stack having Python / SQL / AWS /Containers etc.Maintain the existing applications and add user requested features and enhancementsWork closely with all project stakeholders to gather requirements, develop code","Dallas, TX, USA","Contract, Third Party",Data Internship,42 days ,2024-03-23 03:12:50.544550,21 days ago ,,https://www.dice.com/company/marlabnj?companyname=Marlabs%20LLC,146
Adobe Analytics Lead / Digital Analytics Lead - Must have 10+ years of experience,Photon Interactive UK Limited,"Adobe Analytics Lead / Digital Analytics Lead - Must have 10+ years of experience Onsite at Dallas, TX Job Summary: The Adobe Analytics Architecture Lead is a pivotal role, dedicated to driving the implementation and optimization of Adobe Analytics and Adobe Target. This position demands extensive project leadership and a deep understanding of Adobe platforms, aimed at enhancing data collection capabilities and user experience on our e-commerce platform to significantly boost conversions and sal","Dallas, TX, USA","Contract, Third Party",Data Internship,2 days ,2024-05-02 03:12:50.544550,,,https://www.dice.com/company/10462843?companyname=Photon%20Interactive%20UK%20Limited,146
IT Operations Research & Optimization Engineer,"InnoCore Solutions, Inc.","Requirements: 2+ years of experience with Java and commercial solvers (FICO Xpress, CPLEX, Gurobi)Must be familiar with at least 1 optimization language (IBM CPLEX, GUROBI, or FICO Xpress. FICO Xpress is preferred).2+ years of experience developing and implementing large scale optimization models using MIP and heuristicsDepth of knowledge in at least one OR skill area (e.g., optimization, simulation, statistics)Practical experience with data extraction, cleaning, and analysisDemonstrated aptitud","Dallas, TX, USA",Contract,Data Internship,2 days ,2024-05-02 03:12:50.544550,22 hours ago ,,https://www.dice.com/company/10120357?companyname=InnoCore%20Solutions%2C%20Inc.,146
UX Researcher,ResolveTech Solutions Inc.,"One of our direct clients looking for ""UX Researcher"" in Irving, TX. For this position we are looking candidates who can work at onsite 5 days a week. . Interested candidates please share your updated resume along with your details asap. Job id: 10779 Title: Sr UX Researcher Location: Irving, TX Duration: Long Term Start date: Immediate Work mode: 100% onsite Visa: Any Interview mode: First round online test screen Second round technical screen  Third round final with end client KEY RESPONSIBILI","Dallas, TX, USA","Contract, Third Party",Data Internship,1 day ,2024-05-03 03:12:50.544550,17 hours ago ,,https://www.dice.com/company/10368525?companyname=ResolveTech%20Solutions%20Inc.,146
UX Designer,"InnoCore Solutions, Inc.","Job Duties: Work across UX disciplines to take large, complex applications and transform them into simple, intuitive experiences. Conceptualize, prototype, present and deliver a variety of UX deliverables (personas, flows, research plans, test scripts, low and hi-fidelity mockups). Work with a cross-functional team using Agile methodology to define user stories and UX deliverables Influence design and product owner decisions based on UX best practices, design principles and research Collaborate","Dallas, TX, USA",Contract,Data Internship,2 days ,2024-05-02 03:12:50.560171,22 hours ago ,,https://www.dice.com/company/10120357?companyname=InnoCore%20Solutions%2C%20Inc.,146
Core Java Kafka Streaming Architect (Minimum 15+ Years experience),New York Technology Partners,"Job Title: Java Kafka Streaming (Minimum 15+ Years experience) Location: Dallas - Hybrid Position Type: Long Term Contract  Skill and experience required: 10+ years of technical experience building newly configured, and designed data-centric software solutionsAdvance level knowledge and use of Java 8+ w/experience using Multithreading, Collections, Streams API and functional programming, working on real enterprise projects.Minimum of one year working experience in developing cloud native streami","Dallas, TX, USA","Contract, Third Party",Data Internship,9 days ,2024-04-25 03:12:50.560171,17 hours ago ,,https://www.dice.com/company/10119106?companyname=New%20York%20Technology%20Partners,146
Azure Cloud/DevOps Engineer -  Lead,Astir IT Solutions,"Experience as a cloud/DevOps engineer with Strong scripting skills. Experience with Microsoft Azure cloud services, including IaaS and PaaS technologies. Experience with automation tools such as Azure DevOps, Ansible, Terraform, or Chef. Build and maintain CI/CD pipelines to enable delivery of cloud-native applications. Implement infrastructure as code to automate the deployment of infrastructure resources. Design and implement monitoring and logging solutions for the cloud environment. Collabor","Dallas, TX, USA","Third Party, Contract",Data Internship,60+ days ,2024-03-05 03:12:50.560171,12 hours ago ,,https://www.dice.com/company/10110032?companyname=Astir%20IT%20Solutions,146
IT Applications Delivery Manager,"InnoCore Solutions, Inc.","As an IT Applications Delivery Manager, your primary responsibilities are to provide thought leadership, analysis, transforming, modeling, mentoring, delivery, and product ownership for applications. You will be working closely with your business partner in understanding their needs and designing IT solutions that fit their needs. You will ensure the designed solutions are architecturally sound and are maintainable. You will collaborate with other product owners, leads, and architects on current","Dallas, TX, USA",Contract,Data Internship,2 days ,2024-05-02 03:12:50.560171,22 hours ago ,,https://www.dice.com/company/10120357?companyname=InnoCore%20Solutions%2C%20Inc.,146
