Job Title,Company Name,Job Description,Location,Employment Type,Query_Value,Posted Scraped,Posted On,Updated Scraped,Updated On,Company Link,From Total Job Count
Data Analyst Internship,Job Wize,"Trainee Data Analyst<>REMOTEJob Description:We are seeking an enthusiastic and detail-oriented Trainee Data Analyst to join our growing team. In this entry-level position, you will be introduced to the dynamic world of data analysis, where you will develop essential skills and gain hands-on experience needed to analyze and interpret data across various business functions. Responsibilities:Assist in collecting, tracking, and analyzing data from multiple sources.Support the data analysis team in m","Seattle, WA, USA",Full-time,Data Analytics Internship,15 days ,2024-04-19 03:17:31.182841,15 days ago ,,https://www.dice.com/company/91159959?companyname=Job%20Wize,28
Remote Azure Data and DevOps engineer,CapB InfoteK LLC,"CapB is looking for an experienced Azure Data and Devops engineer. This is 100% Remote position. Job description below. If interested rush your resume to us and let us know your absolute best rate on 1099. No Corp to Corp PRIMARY DUTIES  1 Create and maintain optimal data pipeline architecture.  2 Assemble large, complex data sets that meet functional / non-functional business requirements.  3 Identify, design, and implement internal process improvements: automating manual processes, optimizing","Seattle, WA, USA",Contract,Data Analytics Internship,31 days ,2024-04-03 03:17:31.183845,23 days ago ,,https://www.dice.com/company/10343479?companyname=CapB%20InfoteK%20LLC,28
Remote Predictive Analytics Snowflake Integration consultant Part Time or Full time,CapB InfoteK LLC,"CapB is seeking a Predictive Analytics Snowflake Integration consultants for its ongoing project. the project is 100% remote and can be done on Full time or Part time basis. The consultant on this project will connect existing code to a new cloud-based warehouse.  Currently, existing analytic code is connected to legacy, on-prem warehouses.  Responsibilities will include but not be limited to:  Write associated SQL queries to support two-way communication for 2 statistical models written in R to","Seattle, WA, USA","Contract, Third Party",Data Analytics Internship,39 days ,2024-03-26 03:17:31.183845,23 days ago ,,https://www.dice.com/company/10343479?companyname=CapB%20InfoteK%20LLC,28
BI Engineer :: Remote :: W2 Profiles Only,Aorton Inc,"Role : BI Analytics Engineer  Location: Remote Job Description: Six Month Expectations Contribute to the data pipeline process, creating new pipelines that further data availability on our BI platform Take ownership of portions of our data stack Proactively solve issues or errors within the data pipeline Take an active role in designing the future of our data pipeline or BI platforms Collaborate with the team on best practices and overall business strategy Take ownership of data office hours and","Seattle, WA, USA",Contract,Data Analytics Internship,1 day ,2024-05-03 03:17:31.184841,,,https://www.dice.com/company/91140841?companyname=Aorton%20Inc,28
Azure Data Engineer,"iTech US, Inc.","Need Azure Data Engineer who has some experience working with the DevOps side. Need Local Candidates, Hybrid Role on Seattle, WA. Top Skills' Details ETL Development with Azure stack (Azure Data Factory, Azure Databricks, Azure Blob, Azure SQL). The core function of the role is data ingestion and export to various enterprise systems. Data Engineers are utilizing Snowflake as a data warehouse and Databricks for transformation. Must have demonstrated experience with Azure Data Factory (Snowflake i","Seattle, WA, USA",Contract,Data Analytics Internship,14 days ,2024-04-20 03:17:31.184841,14 days ago ,,https://www.dice.com/company/10115897?companyname=iTech%20US%2C%20Inc.,28
Google Cloud Platform Data Architect,DVG Tech Solutions LLC,"Job Description: The Role We seek an experienced Google Cloud Platform Data Architect to shape and lead our data architecture and analytics initiatives on the Google Cloud Platform. You'll work closely with cross-functional teams to design scalable data solutions, optimize data pipelines, and enable data-driven decision-making across the organization. Key Responsibilities:  Architecture Design: Craft scalable and reliable data architectures on Google Cloud Platform, encompassing data ingestion,","Seattle, WA, USA","Third Party, Contract",Data Analytics Internship,10 days ,2024-04-24 03:17:31.185846,19 hours ago ,,https://www.dice.com/company/90922892?companyname=DVG%20Tech%20Solutions%20LLC,28
Sr Power BI developer with very strong SQL and Data Operations skills || W2 || Any Visa,Shiro Technologies,"Key Skills : Power BI, SQL, Retail Domain Job Summary : The ideal candidate will be part of an organization that is revolutionizing technology platforms and architecting a data and analytics landscape that is simplified, modern, flexible and will ultimately provide a foundation for all future analysis. This role will work closely with the business and technical Key Qualifications : Deep experience, 10 + years of experience in Power BI with very strong SQL. 5+ years visualization in a retail envi","Seattle, WA, USA",Contract,Data Analytics Internship,17 hours ,2024-05-03 10:17:31.186843,,,https://www.dice.com/company/10481525?companyname=Shiro%20Technologies,28
ITSM CMDB / Data Analysis expertise- 100% Remote role - Canada/LATAM Based,Acnovate Business Solutions Inc.,"ITSM CMDB / Data Analysis expertise 100% Remote (Near Shore - Canada/Latin America) Long term Contract Job Description: Configuration Management Database (CMDB) Maintenance: The Asset and Configuration Manager is responsible for managing and maintaining the CMDB in ServiceNow. This involves ensuring accurate and up-to-date information about all configuration items (CIs) within the IT infrastructure, including hardware, software, and other assets. Configuration Identification: Working with differ","Seattle, WA, USA","Contract, Third Party",Data Analytics Internship,37 days ,2024-03-28 03:17:31.187852,20 hours ago ,,https://www.dice.com/company/10127360?companyname=Acnovate%20Business%20Solutions%20Inc.,28
Power BI Developer,Symphony Corporation,"Responsibilities: Quickly assimilate and extract relevant supply chain data from our extensive data lake.Develop, design, and maintain advanced Power BI reports and dashboards specific to supply chain metrics.Utilize complex data sources in a Supply Chain context, including but not limited to inventory levels, logistics performance, and vendor management.Transform raw data into meaningful insights through engaging visuals and interactive reports.Work closely with Supply Chain stakeholders to ide","Seattle, WA, USA",Contract,Data Analytics Internship,14 days ,2024-04-20 03:17:31.188852,,,https://www.dice.com/company/10115170?companyname=Symphony%20Corporation,28
Residential Solutions Architect,Computomic,"Role: Resident Solution Architect (RSA) Experience: 10+ years years consulting, 7+ years in data engineering Location: London /Remote. United Kingdom Background: Computomic was founded in 2019 with a vision to design and deploy mission critical and highly differentiated Data & AI solutions for companies looking to migrate their data stack from legacy data platforms such as Teradata, Cloudera, Datastage and Informatica to modern data platforms like Databricks. Over the last few years, we have bec","Seattle, WA, USA",Contract,Data Analytics Internship,38 days ,2024-03-27 03:17:31.188852,23 days ago ,,https://www.dice.com/company/91129876?companyname=Computomic,28
Data Science with ML,Astir IT Solutions,"Experience with Machine Learning, Data Science, Data Engineering principles and technologies such as R, Python, SQL. Experience delivering and managing AI/ML based software products. Experience with agile software development methodology. Proven experience with data engineering and ETL techniques using data from a wide variety of data sources. Rigorous understanding of statistics/machine learning and ability to discern appropriate analytics techniques to problem-solve. Knowledge of data warehous","Seattle, WA, USA",Contract,Data Analytics Internship,45 days ,2024-03-20 03:17:31.189854,12 hours ago ,,https://www.dice.com/company/10110032?companyname=Astir%20IT%20Solutions,28
IBM Datacap Developer,P2PSoftTek Inc,"IBM Datacap Developer Remote Role Description : Collaborate with stakeholders to gather and analyze business requirements for document capture and data extraction processes.Design and architect IBM Datacap, AWS Textract solutions to meet business needs, including document classification, data extraction, and workflow automation.Develop and customize IBM Datacap, AWS Textract applications flows, modules, and components using Datacap Studio, Datacap Navigator, and other tools.Configure and optimiz","Seattle, WA, USA","Contract, Third Party",Data Analytics Internship,24 days ,2024-04-10 03:17:31.189854,19 hours ago ,,https://www.dice.com/company/90868495?companyname=P2PSoftTek%20Inc,28
ETL ODI Developer,P2PSoftTek Inc,"ETL ODI Developer Remote Role  Description  ODI Experience Proficient in PL SQL, Oracle SQL Plusses SSIS experience - OBI: Operations business intelligence - Data analytics/data science - Business IT unit - Why? We sit in business and provide analytics solution to the business - Most of work supports electric ops and working with field crews, office, working with EMS data, ATMS, GIS, SAP, all sorts of data sets 70 different data sets analytics on data - Oracle based technology stack - Solutions","Seattle, WA, USA","Contract, Third Party",Data Analytics Internship,60+ days ,2024-03-05 03:17:31.190848,19 hours ago ,,https://www.dice.com/company/90868495?companyname=P2PSoftTek%20Inc,28
Enterprise Data Speclialist,Genome International Corp,"looking for a contractor to provide Data Governance services in support of the Statewide Longitudinal Data Systems (SLDS) federal grant efforts. CDE received the grant award in 2020, and it will continue through February 2025. The early years of the grant focused on two use case areas, Adult Education (AE) and Concurrent Enrollment (CE). There is a significant technology component to this grant effort, CDE already has data-linking technology in place and part of the grant commitment is to modern","Seattle, WA, USA",Contract,Data Analytics Internship,44 days ,2024-03-21 03:17:31.191851,1 day ago ,,https://www.dice.com/company/genwi001?companyname=Genome%20International%20Corp,28
Consulting Director - Digital Transformation (remote),RedRiver Systems L.L.C.,"Great opportunity within growing international company developing state-of-the-art products supporting IoT and communication systems worldwide. This is a hands-on opportunity working with customers creating Digital Transformation solutions to drive their Overall Equipment Effectiveness. RESPONSIBILITIES Identify, prioritize, frame and structure complex and ambiguous challenges to help clients build realistic and scalable digital strategies that meet their company specific needs.Lead Digital Tran","Seattle, WA, USA",Full-time,Data Analytics Internship,9 days ,2024-04-25 03:17:31.192847,20 hours ago ,,https://www.dice.com/company/10122941?companyname=RedRiver%20Systems%20L.L.C.,28
Test Do Not Apply - Senior Full Stack Developer,Dice US Sales Demo Account,"Job Type: Full-time Location: Greenwood Village, Colorado We are seeking an experienced Senior Full Stack Developer to join our dynamic team. The successful candidate will be responsible for developing, maintaining, and enhancing web applications that meet the needs of our clients. As a Senior Full Stack Developer, you will work closely with our cross-functional teams to ensure that our products are delivered on time, within budget, and to the highest quality standards. Responsibilities: Develop","Seattle, WA, USA",Full-time,Data Analytics Internship,18 days ,2024-04-16 03:17:31.193848,4 days ago ,,https://www.dice.com/company/dicedemo?companyname=Dice%20US%20Sales%20Demo%20Account,28
Sales Leader - Insurance,"IRIS Software, Inc.","About IRIS Software Inc. IRIS Software Inc. ( has a proven legacy of over 3 decades in helping our enterprise clients thrive with technology-enabled transformation across Banking, Financial Services, Insurance, Life Sciences, Healthcare, Professional Services, Manufacturing, Transportation, and Logistics sectors. Our services cover core, complex, mission-critical Application and Product Engineering, Data and Analytics, Cloud Engineering, DevSecOps, Quality Engineering, UX transformation, and Bus","Seattle, WA, USA","Full-time, Third Party",Data Analytics Internship,60+ days ,2024-03-05 03:17:31.194841,8 days ago ,,https://www.dice.com/company/irissoft?companyname=IRIS%20Software%2C%20Inc.,28
"ServiceNow Architect field service module mandatory , Remote",Spiceorb,"Hi, This is Upasna from Spiceorb.we have opening for Servicenow Architect role.If you are available and interested send your updated resume to  ServiceNow Architect, remote role The ServiceNow Architect plays a critical role in the design, implementation, and optimization of ServiceNow solutions within the organization.This position requires a deep understanding of the ServiceNow platform, IT service management processes, and business requirements to architect solutions that drive efficiency, au","Seattle, WA, USA","Contract, Third Party",Data Analytics Internship,9 days ,2024-04-25 03:17:31.194841,7 days ago ,,https://www.dice.com/company/91109480?companyname=Spiceorb,28
Workday Prism Developer,HL Solutions LLC,"Workday Prism Developer  Expert in developing complex Workday Prism Pipelines and handling high volumes of data in and out of Workday Prism Analytics  Extensive hands-on experience in Prism Transformations such as Unpivot, Group by, Filter, Rank  Good understanding of Data Change Tasks (DCTs) to perform CRUD operations  Hands-on Experience in creating Custom Organizations, Base Data Sets, Derived Datasets  Able to understand business requirements, develop and deliver code in a fast-paced environ","Seattle, WA, USA","Third Party, Contract",Data Analytics Internship,19 hours ,2024-05-03 08:17:31.195853,,,https://www.dice.com/company/91089103?companyname=HL%20Solutions%20LLC,28
Adobe AEP/ CJA/ AJO/ Personalization engineer,Central Business Solutions,"Title: Adobe AEP/ CJA/ AJO/ Personalization engineer Location: 100% Remote Job Description: Lead execution of the Adobe marketing capabilities and leveraging Adobe suites such as Adobe Analytics, Audience Manager, AEM, Target, and Adobe Journey Optimizer.Utilize a range of Adobe tools including Web SDK, XDM schemas, and Adobe Experience Platform tools for seamless data integration, analysis, and optimization.Collaborate across teams to integrate and optimize the usage of Adobe Experience Platfor","Seattle, WA, USA","Contract, Third Party",Data Analytics Internship,60+ days ,2024-03-05 03:17:31.196852,12 hours ago ,,https://www.dice.com/company/10121769?companyname=Central%20Business%20Solutions,28
Senior Saviynt Developer,Accolite Digital LLC,"Bounteous x Accolite makes the future faster for the world's most ambitious brands. Our services span Strategy, Analytics, Digital Engineering, Cloud, Data & AI, Experience Design, and Marketing. We are guided by Co-Innovation, our proven methodology of collaborative partnership. Bounteous x Accolite brings together 5000+ employees spanning North America, APAC, and EMEA, and partnerships with leading technology providers. Through advanced digital engineering, technology solutions, and data-drive","Seattle, WA, USA","Contract, Third Party",Data Analytics Internship,9 days ,2024-04-25 03:17:31.196852,,,https://www.dice.com/company/10300908?companyname=Accolite%20Digital%20LLC,28
SAP BPC Solution Architect,VLink Inc,"Title: SAP BPC Solution Architect Location: Kalamazoo, MI (Remote) Participate in requirement gathering and design phase to define business requirements and system blueprint designBuild SAP BPC model & dimensionPerform SAP BPC system configuration such as business process flow and business rules.Development and support of all BPC objects that includes reports, input templates, master/meta data, logic scripts, business rules, BPF, work status, batch schedulesWrite code in Script Logic / Fox and A","Seattle, WA, USA","Third Party, Contract",Data Analytics Internship,10 days ,2024-04-24 03:17:31.197852,,,https://www.dice.com/company/RTL109178?companyname=VLink%20Inc,28
Consulting Lead - Enterprise & IT Strategy,"ReQignition, Inc.","Company Description  BLEND360 is an award-winning, new breed Data Science Consultancy focused on powering exceptional results for our Fortune 500/1000 clients and other major organizations. We are a growing company born at the intersection of advanced analytics, data, and technology. Who we are: People are everything here at BLEND360.  We are inspired by advancing our Client s most critical initiatives, products and projects by matching our clients with the right talent. BLEND360 has been among","Seattle, WA, USA",Full-time,Data Analytics Internship,24 days ,2024-04-10 03:17:31.198866,,,https://www.dice.com/company/90941004?companyname=ReQignition%2C%20Inc.,28
Lead Salesforce Developer,Incedo Inc,"Position: Salesforce Technical Lead  Location: Pittsburgh, PA (remote) Duration: Full time As a Salesforce Lead with expertise in Experience Cloud, Service Cloud, and Marketing Cloud, you will play a critical role in the design, development, and maintenance of our client s Salesforce ecosystem. Must have experience in working with globally distributed teams and agile delivery. You will collaborate with cross-functional teams to implement and optimize solutions that enhance customer experiences,","Seattle, WA, USA",Full-time,Data Analytics Internship,3 days ,2024-05-01 03:17:31.198866,,,https://www.dice.com/company/10476889?companyname=Incedo%20Inc,28
Tricentis Tosca Neoload Architect,SumasEdge Corporation,"We are seeking a skilled and experienced Tricentis Tosca & NeoLoad Architect to join our dynamic team. The ideal candidate will have a strong background in software testing, particularly in test automation using Tricentis Tosca, as well as performance testing using NeoLoad. This role will involve designing, implementing, and optimizing test automation and performance testing solutions to ensure the quality and scalability of our software products.  Responsibilities:  Design and implement test au","Seattle, WA, USA","Third Party, Contract",Data Analytics Internship,23 days ,2024-04-11 03:17:31.199867,16 hours ago ,,https://www.dice.com/company/90859492?companyname=SumasEdge%20Corporation,28
Automation Architect,Qualibar,"Job Title: Automation Architect Position: Full Time Client: PWC Location: Remote//Remote/Hybrid  Description: Experience in creation of application specific test strategy and Automation test plan Expertise in creation / maintenance of Test Automation framework (Hybrid / TDD / BDD) from scratch Expertise in creation of API / UI Automated test scripts using Selenium with Java & RestAPI/SoapUI  Exposure and experience in Katalon, Parasoft and Azure ADO are added advantage Hands on experience in del","Seattle, WA, USA",Full-time,Data Analytics Internship,60+ days ,2024-03-05 03:17:31.199867,19 hours ago ,,https://www.dice.com/company/91132260?companyname=Qualibar,28
Kafka Admin,Galax-Esystems Corp,"Role Kafka Tech Admin Location: Remote Duration:6-12 Months Job Responsibility Primary responsibility of Confluent Platform Administrator will be to build, test and maintain Kafka Cluster and its eco-system which is deployed to run Data Streaming use cases for various business units Experience Overall 5+ years of experience out of which 2+ years around Confluent Platform administration Mandatory Job Requirements Manage single and multi-node Kafka cluster deployed on VM, Docker and Kubernetes Con","Seattle, WA, USA","Contract, Third Party",Data Analytics Internship,13 hours ,2024-05-03 14:17:31.200867,,,https://www.dice.com/company/10230239?companyname=Galax-Esystems%20Corp,28
Sr Kronos Analyst,"Amzur Technologies, Inc.",Need 10+ Years of ExperienceMUST HAVE Strong functional knowledge of Kronos modules including: Workforce Dimensions Workforce Dimensions Timekeeping Workforce Dimensions Accruals Workforce Dimensions Absence Workforce Dimensions Analytics Proficient in CRT s Reporting Kronos Integration Dell Boomi Workforce Dimensions Integration PlatformExperience working with enterprise level customers  Overview The Kronos Technical Consultant is responsible for ensuring technology solutions address business r,"Seattle, WA, USA","Contract, Third Party",Data Analytics Internship,60+ days ,2024-03-05 03:17:31.201867,15 hours ago ,,https://www.dice.com/company/10115656?companyname=Amzur%20Technologies%2C%20Inc.,28
