ETL ODI Developer,P2PSoftTek Inc,"ETL ODI Developer Remote Role  Description  ODI Experience Proficient in PL SQL, Oracle SQL Plusses SSIS experience - OBI: Operations business intelligence - Data analytics/data science - Business IT unit - Why? We sit in business and provide analytics solution to the business - Most of work supports electric ops and working with field crews, office, working with EMS data, ATMS, GIS, SAP, all sorts of data sets 70 different data sets analytics on data - Oracle based technology stack - Solutions","Dallas, TX, USA","Contract, Third Party",Data Scientist,60+ days ,2024-03-05 03:09:46.542852,19 hours ago ,,https://www.dice.com/company/90868495?companyname=P2PSoftTek%20Inc,135
Consulting Director - Digital Transformation (remote),RedRiver Systems L.L.C.,"Great opportunity within growing international company developing state-of-the-art products supporting IoT and communication systems worldwide. This is a hands-on opportunity working with customers creating Digital Transformation solutions to drive their Overall Equipment Effectiveness. RESPONSIBILITIES Identify, prioritize, frame and structure complex and ambiguous challenges to help clients build realistic and scalable digital strategies that meet their company specific needs.Lead Digital Tran","Dallas, TX, USA",Full-time,Data Scientist,9 days ,2024-04-25 03:09:46.542852,20 hours ago ,,https://www.dice.com/company/10122941?companyname=RedRiver%20Systems%20L.L.C.,135
AI Engineer - Open Source Models Specialist,P2PSoftTek Inc,"AI Engineer - Open Source Models Specialist Remote Description :  1. Research, develop, and implement state-of-the-art AI models using open source frameworks and tools, with a focus on Hugging Face Datasets. 2. Fine-tune pre-trained models to specific tasks and domains, ensuring optimal performance and accuracy. 3. Build and optimize NLP encoders and transformers to support various natural language processing tasks and applications. 4. Design and maintain a scalable vector database for efficient","Dallas, TX, USA","Contract, Third Party",Data Scientist,7 days ,2024-04-27 03:09:46.543852,19 hours ago ,,https://www.dice.com/company/90868495?companyname=P2PSoftTek%20Inc,135
Test Do Not Apply - Senior Full Stack Developer,Dice US Sales Demo Account,"Job Type: Full-time Location: Greenwood Village, Colorado We are seeking an experienced Senior Full Stack Developer to join our dynamic team. The successful candidate will be responsible for developing, maintaining, and enhancing web applications that meet the needs of our clients. As a Senior Full Stack Developer, you will work closely with our cross-functional teams to ensure that our products are delivered on time, within budget, and to the highest quality standards. Responsibilities: Develop","Dallas, TX, USA",Full-time,Data Scientist,18 days ,2024-04-16 03:09:46.543852,4 days ago ,,https://www.dice.com/company/dicedemo?companyname=Dice%20US%20Sales%20Demo%20Account,135
Software Engineer in Test - Playwright with Typescript,Vidorra Consulting Group,"Visa Sponsorship is available for this opportunity. Our reputed client based out of the Houston area is seeking for multiple Sr. Full Stack Quality Engineer with strong hands-on Manual testing experience on cloud-based infrastructure and services in Serverless, Event driven architectures on Azure cloud. Deep understanding and problem-solving ability of various complexities, experience collaborating on teams with multiple disciplines (DevOps, Data engineers, Software engineers). Self-organized an","Dallas, TX, USA",Full-time,Data Scientist,60+ days ,2024-03-05 03:09:46.544866,8 days ago ,,https://www.dice.com/company/RTX1a5d37?companyname=Vidorra%20Consulting%20Group,135
"MS SQL Developer (SSIS/ SSRS) -Dallas/ Plano, TX- contract(Onsite)",Apexon,"MS SQL Developer (SSIS/ SSRS) -Dallas/ Plano, TX- contract (Onsite)  The Database Developer will be responsible for creating and maintaining database software to meet functional, performance, and availability goals. Additionally, the developer will be expected to support peers, follow standards, and make technical recommendations. ESSENTIAL DUTIES AND RESPONSIBILITIES include the following.  Other duties and tasks may be assigned. Perform in an independent capacity and set a strong example for o","Dallas, TX, USA","Contract, Third Party",Data Scientist,1 day ,2024-05-03 03:09:46.545866,,,https://www.dice.com/company/tecnos?companyname=Apexon,135
big data engineer,Lincoln Softtech LLC,"ob Title:Azure Data Engineer Onsite - Dallas,TX and Chicago,IL Need Only Locals  Send 12+ Profiles only  Experience working with and extracting value from large, disconnected and/or unstructured datasets Demonstrated ability to build processes that support data transformation, data structures, metadata, dependency and workload management Strong interpersonal skills and ability to project manage and work with cross-functional teams Advanced working SQL knowledge and experience working with relati","Dallas, TX, USA","Third Party, Contract",Data Scientist,15 days ,2024-04-19 03:09:46.546867,4 days ago ,,https://www.dice.com/company/91138517?companyname=Lincoln%20Softtech%20LLC,135
Java Microservices Lead/Developer,Photon Interactive UK Limited,"Greeting Everyone! Hope you are staying safe. We are looking for a Java Microservices Lead/Developer to join our digital platform team for new initiatives. Who are we? For the past 20 years, we have powered many Digital Experiences for the Fortune 100. Since 1999, we have grown from a few people to more than 5000 team members across the globe that are engaged in various Digital Modernization. For a brief 1 minute video about us, you can check ;/p>What are we looking for? A candidate should have","Dallas, TX, USA",Full-time,Data Scientist,11 days ,2024-04-23 03:09:46.546867,9 days ago ,,https://www.dice.com/company/10462843?companyname=Photon%20Interactive%20UK%20Limited,135
ServiceNow Developer,CrackaJack Digital Solutions,"Plano, TX, Columbus, OH & Wilmington, DE Job responsibilities: Executes software solutions, design, development, and technical troubleshooting with ability to think beyond routine or conventional approaches to build solutions or break down technical problems Creates secure and high-quality production code and maintains algorithms that run synchronously with appropriate systems Produces architecture and design artifacts for complex applications while being accountable for ensuring design constrai","Dallas, TX, USA","Contract, Third Party",Data Scientist,1 day ,2024-05-03 03:09:46.547866,,,https://www.dice.com/company/91021502?companyname=CrackaJack%20Digital%20Solutions,135
Strategic Sales Lead,RisamSoft Inc,"As the Strategic Sales Lead, you will oversee the entire sales cycle, from pipeline creation and opportunity qualification to securing deals with new clients tailored to the industry. Working closely with our leadership, advisory team, and technical experts, you will devise strategies to ensure optimal outcomes throughout the sales process. Key Duties and Responsibilities: Collaborate with leadership, technical teams, and advisors to develop a sales strategy that exceeds targets, builds a robust","Dallas, TX, USA",Full-time,Data Scientist,19 days ,2024-04-15 03:09:46.548853,,,https://www.dice.com/company/91112109?companyname=RisamSoft%20Inc,135
Data Engineer (8 Openings),Trigint Solutions,"Required Skills:  +10 years in Data Engineering and Analytics Expertise in data analytical skills and handling big data along with real time streaming. Graph Ontology and semantic modeling with GraphQL or SPARQL experience is a must Proactive, self-driven, works independently and collaborates well. Expertise in Python, Pyspark Use of databricks is a must.","Dallas, TX, USA",Contract,Data Scientist,2 days ,2024-05-02 03:09:46.549866,,,https://www.dice.com/company/90999304?companyname=Trigint%20Solutions,135
Python Developer - Tampa / Dallas - 3 days in office,Marlabs LLC,"Please email me your resumes @  ()or call me on my cell . Job Title: Python Developer Location: Dallas / Tampa  Duration: 6-12 months extendable  Job Description:  Build new applications with Python as the core in the AWS environmentRe-platform existing applications to a modern technology stack having Python / SQL / AWS /Containers etc.Maintain the existing applications and add user requested features and enhancementsWork closely with all project stakeholders to gather requirements, develop code","Dallas, TX, USA","Contract, Third Party",Data Scientist,42 days ,2024-03-23 03:09:46.549866,21 days ago ,,https://www.dice.com/company/marlabnj?companyname=Marlabs%20LLC,135
Adobe Analytics Lead / Digital Analytics Lead - Must have 10+ years of experience,Photon Interactive UK Limited,"Adobe Analytics Lead / Digital Analytics Lead - Must have 10+ years of experience Onsite at Dallas, TX Job Summary: The Adobe Analytics Architecture Lead is a pivotal role, dedicated to driving the implementation and optimization of Adobe Analytics and Adobe Target. This position demands extensive project leadership and a deep understanding of Adobe platforms, aimed at enhancing data collection capabilities and user experience on our e-commerce platform to significantly boost conversions and sal","Dallas, TX, USA","Contract, Third Party",Data Scientist,2 days ,2024-05-02 03:09:46.550866,,,https://www.dice.com/company/10462843?companyname=Photon%20Interactive%20UK%20Limited,135
IT Operations Research & Optimization Engineer,"InnoCore Solutions, Inc.","Requirements: 2+ years of experience with Java and commercial solvers (FICO Xpress, CPLEX, Gurobi)Must be familiar with at least 1 optimization language (IBM CPLEX, GUROBI, or FICO Xpress. FICO Xpress is preferred).2+ years of experience developing and implementing large scale optimization models using MIP and heuristicsDepth of knowledge in at least one OR skill area (e.g., optimization, simulation, statistics)Practical experience with data extraction, cleaning, and analysisDemonstrated aptitud","Dallas, TX, USA",Contract,Data Scientist,2 days ,2024-05-02 03:09:46.550866,22 hours ago ,,https://www.dice.com/company/10120357?companyname=InnoCore%20Solutions%2C%20Inc.,135
ServiceNow Developer,Info Dinamica Inc,"Must Have:  Certifications verified Minimum two (Certification Verification email require from suppliers)Role verified Should be part of core development and Implementation team. Done scripting and Rest API based integrations.Understand converting a Business Requirements to a workflow and implement the same.HR Service Delivery module experienceService portal experience.Job responsibilities Executes software solutions, design, development, and technical troubleshooting with ability to think beyon","Dallas, TX, USA",Contract,Data Scientist,3 days ,2024-05-01 03:09:46.551866,,,https://www.dice.com/company/91091604?companyname=Info%20Dinamica%20Inc,135
UX Researcher,ResolveTech Solutions Inc.,"One of our direct clients looking for ""UX Researcher"" in Irving, TX. For this position we are looking candidates who can work at onsite 5 days a week. . Interested candidates please share your updated resume along with your details asap. Job id: 10779 Title: Sr UX Researcher Location: Irving, TX Duration: Long Term Start date: Immediate Work mode: 100% onsite Visa: Any Interview mode: First round online test screen Second round technical screen  Third round final with end client KEY RESPONSIBILI","Dallas, TX, USA","Contract, Third Party",Data Scientist,1 day ,2024-05-03 03:09:46.552866,17 hours ago ,,https://www.dice.com/company/10368525?companyname=ResolveTech%20Solutions%20Inc.,135
UX Designer,"InnoCore Solutions, Inc.","Job Duties: Work across UX disciplines to take large, complex applications and transform them into simple, intuitive experiences. Conceptualize, prototype, present and deliver a variety of UX deliverables (personas, flows, research plans, test scripts, low and hi-fidelity mockups). Work with a cross-functional team using Agile methodology to define user stories and UX deliverables Influence design and product owner decisions based on UX best practices, design principles and research Collaborate","Dallas, TX, USA",Contract,Data Scientist,2 days ,2024-05-02 03:09:46.552866,22 hours ago ,,https://www.dice.com/company/10120357?companyname=InnoCore%20Solutions%2C%20Inc.,135
Core Java Kafka Streaming Architect (Minimum 15+ Years experience),New York Technology Partners,"Job Title: Java Kafka Streaming (Minimum 15+ Years experience) Location: Dallas - Hybrid Position Type: Long Term Contract  Skill and experience required: 10+ years of technical experience building newly configured, and designed data-centric software solutionsAdvance level knowledge and use of Java 8+ w/experience using Multithreading, Collections, Streams API and functional programming, working on real enterprise projects.Minimum of one year working experience in developing cloud native streami","Dallas, TX, USA","Contract, Third Party",Data Scientist,9 days ,2024-04-25 03:09:46.553852,17 hours ago ,,https://www.dice.com/company/10119106?companyname=New%20York%20Technology%20Partners,135
IT Applications Delivery Manager,"InnoCore Solutions, Inc.","As an IT Applications Delivery Manager, your primary responsibilities are to provide thought leadership, analysis, transforming, modeling, mentoring, delivery, and product ownership for applications. You will be working closely with your business partner in understanding their needs and designing IT solutions that fit their needs. You will ensure the designed solutions are architecturally sound and are maintainable. You will collaborate with other product owners, leads, and architects on current","Dallas, TX, USA",Contract,Data Scientist,2 days ,2024-05-02 03:09:46.554857,22 hours ago ,,https://www.dice.com/company/10120357?companyname=InnoCore%20Solutions%2C%20Inc.,135
SAP FICO with Pre-sales,Yash Technologies,"Company Description YASH Technologies is a 25+ year-young company with a goal to quadruple our revenue in the next 4 years. The kind of energy typical in a start-up, mixed with a strong foundation is what you will get to see at YASH today. As they say, what got you this far is not enough to get you to the next big milestone; and we are at that inflexion point. As a part of our growth plans, we are in the process of building on our strengths, while changing the way we operate internally and how w","Dallas, TX, USA",Full-time,Data Scientist,24 days ,2024-04-10 03:09:46.554857,16 days ago ,,https://www.dice.com/company/10111847?companyname=Yash%20Technologies,135
Lead Fullstack Developer,Fusion Global Solutions,"Lead FullStack Engineer Irving, TX 12+ Months Required Qualifications: Bachelor s degree or foreign equivalent required from reputed institutions. At least 15 years of experience in Information Technology. At least 5 years of experience leading application development team (minimum 6 - 8 members) for AWS target environment (Web/Mobile/ Desktop applications) At least 5 years in JavaScript, Typescript At least 5 years in PHP, Python, VueJs or React At least 5 years in Microservice architecture Exc","Dallas, TX, USA","Contract, Third Party",Data Scientist,14 days ,2024-04-20 03:09:46.555867,,,https://www.dice.com/company/91122985?companyname=Fusion%20Global%20Solutions,135
Python Developer,Photon Interactive UK Limited,"Python Developer Onsite role at Dallas, TX W2 role Responsibilities: Coordinating with development teams to determine application requirements.Writing scalable code using Python programming language.Testing and debugging applications.Developing back-end components.Integrating user-facing elements using server-side logic.Assessing and prioritizing client feature requests.Integrating data storage solutions.Coordinating with front-end developers.Reprogramming existing databases to improve functiona","Dallas, TX, USA",Full-time,Data Scientist,24 days ,2024-04-10 03:09:46.556866,,,https://www.dice.com/company/10462843?companyname=Photon%20Interactive%20UK%20Limited,135
QA Test Automation engineer,ResolveTech Solutions Inc.,"MUST HAVE SPECIFIC KNOWLEDGE AND SKILLS 8+ years of overall QA testing experience. 3-4 years of hands-on experience with the ownership of software project testing: defining test strategy, writing test plans, designing and executing software tests, preparing test data, bug tracking, reporting. Heavily involved in end to end testing and back-end validations including database and API testing. Exceptional SQL and database querying skills. 3+ years of recent QA automation experience with tools such","Dallas, TX, USA",Contract,Data Scientist,60+ days ,2024-03-05 03:09:46.556866,16 days ago ,,https://www.dice.com/company/10368525?companyname=ResolveTech%20Solutions%20Inc.,135
SAP FI/CO Consultant (hybrid),VLink Inc,"Hope you are doing good, We have very urgent role for SAP FI/CO Consultant for Plano, TX (Hybrid) role kindly have a look the requirement and revert me back with your updated. Role: SAP FI/CO Consultant Location: Plano, TX (Hybrid) Duration : 12 Months Our SAP S/4 HANA Implementation FI/CO Consultant will lead a team chartered with the implementation of SAP S/4 HANA. Duties include but may not be limited to: Educate local teams on basis SAP S/4 HANA Finance, Accounting and Controlling functional","Dallas, TX, USA",Contract,Data Scientist,8 days ,2024-04-26 03:09:46.557852,,,https://www.dice.com/company/RTL109178?companyname=VLink%20Inc,135
"BA with Mortgage - no remote, 3 days in office",Marlabs LLC,"Please email me your resumes @  ()or call me on my cell . Job Title: BA- Mortgage / Onsite from Day one. NO REMOTE  Location: Irving, TX Duration: 6-12 months Detail Job Description: Experience in Mortgage domain mandatory Business System Analyst fulfills analyst activities specific to their department that are found in agile and traditional software development and process engineering organization. This role is responsible for leading discrete projects that are focused on creating efficiency wi","Dallas, TX, USA","Contract, Third Party",Data Scientist,60+ days ,2024-03-05 03:09:46.558866,21 days ago ,,https://www.dice.com/company/marlabnj?companyname=Marlabs%20LLC,135
Angular Developer,"Innova Solutions, Inc","Innova Solutions is immediately hiring for an Angular Developer Position Type: Full-Time Contract Duration: 12+ months Location: Jersey City, NJ / Plano, TX (Onsite role in Hybrid Model 3 days onsite in a week) As an Angular Developer, you will: Top Skills Good UI expert- Angular and JavaScriptLooking for a good JavaScript expert- solid basic conceptsSenior guy, Angular 8+ - someone who has worked on large-sized projects.Upgrading from Angular 12- 16 right nowEducation: B.E, B. Tech/MCA; Experie","Dallas, TX, USA",Contract,Data Scientist,42 days ,2024-03-23 03:09:46.558866,7 days ago ,,https://www.dice.com/company/10115307?companyname=Innova%20Solutions%2C%20Inc,135
BI Engineer :: Remote :: W2 Profiles Only,Aorton Inc,"Role : BI Analytics Engineer  Location: Remote Job Description: Six Month Expectations Contribute to the data pipeline process, creating new pipelines that further data availability on our BI platform Take ownership of portions of our data stack Proactively solve issues or errors within the data pipeline Take an active role in designing the future of our data pipeline or BI platforms Collaborate with the team on best practices and overall business strategy Take ownership of data office hours and","Dallas, TX, USA",Contract,Data Scientist,1 day ,2024-05-03 03:09:46.559852,,,https://www.dice.com/company/91140841?companyname=Aorton%20Inc,135
Azure Databricks Engineer,SumasEdge Corporation,"Responsibilities: Hands on development and support of new or existing data applications.Work closely with business and analysts to understand data and business processes and make recommendations to clients as requested on best practices or long-term solutions to resolve current issues and also for future system designWorks closely with Application and Enterprise Architects to create/review low level implementation designs, understand high level data flow designs developed by data architects.Prov","Dallas, TX, USA","Contract, Third Party",Data Scientist,2 days ,2024-05-02 03:09:46.560855,16 hours ago ,,https://www.dice.com/company/90859492?companyname=SumasEdge%20Corporation,135
Cloud Architect-Google Cloud Platform,Cloudpaths,"Looking for a Google Cloud Platform Engineer/Google Cloud Platform Developer for one of my direct clients in US. The client is neither looking for core data engineer nor DevOps/SRE. Required: - Experience in leading the architecture and design of complex cloud solutions on Google Cloud Platform (Google Cloud Platform) to meet business objectives and performance requirements.Experience in developing and implement data storage and management strategies on Google Cloud Platform, utilizing services","Dallas, TX, USA","Contract, Third Party",Data Scientist,16 hours ,2024-05-03 11:09:46.560855,,,https://www.dice.com/company/91016258?companyname=Cloudpaths,135
Workday Prism Developer,HL Solutions LLC,"Workday Prism Developer  Expert in developing complex Workday Prism Pipelines and handling high volumes of data in and out of Workday Prism Analytics  Extensive hands-on experience in Prism Transformations such as Unpivot, Group by, Filter, Rank  Good understanding of Data Change Tasks (DCTs) to perform CRUD operations  Hands-on Experience in creating Custom Organizations, Base Data Sets, Derived Datasets  Able to understand business requirements, develop and deliver code in a fast-paced environ","Dallas, TX, USA","Third Party, Contract",Data Scientist,19 hours ,2024-05-03 08:09:46.561867,,,https://www.dice.com/company/91089103?companyname=HL%20Solutions%20LLC,135
Role : Sr.Machine Learning Operations Engineer - Remote ( Full Time ),Radiantze,"Job Summary: Role : Sr.Machine Learning Operations EngineerRemoteFulltime  JD: As a Senior Machine Learning Operations (MLOps) Engineer, you will be instrumental in deploying robust, scalable machine learning solutions. You will ensure these are tailored to meet the expansive needs of CVS Health s varied healthcare services. This role demands a high level of proficiency in machine learning technologies and programming, coupled with rigorous vetting processes to maintain the highest standards of","Dallas, TX, USA","Full-time, Third Party",Data Scientist,3 days ,2024-05-01 03:09:46.562852,,,https://www.dice.com/company/91140385?companyname=Radiantze,135
Neo4j Data Engineer,Incedo Inc,"Position: Neo4j Data Engineer Location: Pittsburgh, PA (Remote) Duration: Full time Qualifications Minimum 3+ years of working experience with knowledge graphs/graph databasesExpertise with Graph database technology especially Neo4JExpertise with Python, and related software engineering platforms/frameworksExperience in designing and building highly scalable Knowledge Graphs in productionExperience developing APIs leveraging knowledge graph dataExperience with querying knowledge graphs using a g","Dallas, TX, USA",Full-time,Data Scientist,3 days ,2024-05-01 03:09:46.562852,,,https://www.dice.com/company/10476889?companyname=Incedo%20Inc,135
Mediation Developer with Digitalroute Experience at Remote locations,Accion Labs,"Job Title: Mediation Developer (Digital Route) Location: Remote Job Summary: We are seeking a talented and experienced Mediation Developer specializing in Digital Route to join our dynamic team. As a Mediation Developer, you will be responsible for designing, developing, and implementing mediation solutions using Digital Route Mediation platform. You will work closely with cross-functional teams to ensure seamless integration of mediation systems with various data sources and downstream systems.","Dallas, TX, USA","Contract, Third Party",Data Scientist,19 hours ,2024-05-03 08:09:46.563866,,,https://www.dice.com/company/10428868?companyname=Accion%20Labs,135
Mediation Developer (Digital Route),AmmaluIT,"Job Summary: We are seeking a talented and experienced Mediation Developer specializing in Digital Route to join our dynamic team. As a Mediation Developer, you will be responsible for designing, developing, and implementing mediation solutions using Digital Route Mediation platform. You will work closely with cross-functional teams to ensure seamless integration of mediation systems with various data sources and downstream systems. The ideal candidate will have a strong understanding of mediati","Dallas, TX, USA","Contract, Third Party",Data Scientist,8 days ,2024-04-26 03:09:46.564852,,,https://www.dice.com/company/RTX1ce8c7?companyname=AmmaluIT,135
"Oracle Fusion Developers - Financials, HCM and SCM- (Multiple Roles)",Orasys LLC,"Looking for Multiple Positions for Experienced Oracle Fusion Developers with the below Skills with the following Skills: With Expert level; Working Experience of Oracle Fusion Financials, HCM and SCM.Experience with OIC and Design and Develop Integrations.Experience with Reports and Reporting Solutions(BI/OTBI)Experience with HCM ExtractsExperience with HCM Fast Formulas (Payroll, Benefits, Absence and Time and Labor)Should be able work independently. Expert with Data Conversions. HCM Data Loade","Dallas, TX, USA",Full-time,Data Scientist,9 days ,2024-04-25 03:09:46.564852,3 days ago ,,https://www.dice.com/company/RTX15035d?companyname=Orasys%20LLC,135
